title,condition,price,sold_date,num_bids,buy_it_now,best_offer
Shop on eBay,Brand New,$20.00,,,Yes,No
Genuine Oakley Men's OO9343 M2 Frame XL Polarized Sunglasses Matte Black/Prizm,Brand New,$175.00,"Sold  Dec 10, 2023Sold Item",,No,Yes
Oakley M Frame Sunglasses,Pre-Owned,$72.85,"Sold  Dec 10, 2023Sold Item",12 bids,No,No
OAKLEY M2 FRAME XL OO 9343-19 Matte Black / Prizm Black Polarized Sunglasses,New (Other),$109.99,"Sold  Dec 10, 2023Sold Item",,Yes,No
Vintage OAKLEY M Frame Sunglasses MADE IN USA Silver Frame Black Lens Raiders,Pre-Owned,$94.99,"Sold  Dec 10, 2023Sold Item",,Yes,No
Oakley M Frame Men's Wrap Sunglasses - vintage used,Pre-Owned,$87.00,"Sold  Dec 10, 2023Sold Item",22 bids,No,No
New ListingVINTAGE 90s OAKLEY Sunglasses Bundle Lot M Frame,Pre-Owned,$149.00,"Sold  Dec 10, 2023Sold Item",1 bid,No,No
"Oakley ""New"" M frame blue",Pre-Owned,$75.00,"Sold  Dec 10, 2023Sold Item",1 bid,No,No
Oakley M Frame Sunglasses,Pre-Owned,$41.00,"Sold  Dec 10, 2023Sold Item",10 bids,No,No
RARE COLOR Oakley M Frames Pro Polished Aluminum/G30 Iridium Strike,Pre-Owned,$150.00,"Sold  Dec 10, 2023Sold Item",,No,Yes
New ListingOakley SI M FRAME 2.0 Glasses Z87 Matte Black Lenses Scratched,Pre-Owned,$24.99,"Sold  Dec 10, 2023Sold Item",,Yes,No
Oakley SI Ballistic M Frame 2.0 Strike Safety Shooting Glasses Kit,Pre-Owned,$49.99,"Sold  Dec 10, 2023Sold Item",,Yes,No
Galaxy Replacement Lens For Oakley Si Ballistic M Frame 3.0 Z87 Multi-Selection,New (Other),$5.88 to $20.98,"Sold  Dec 10, 2023Sold Item",,Yes,No
New ListingVINTAGE 90s OAKLEY Sunglasses Bundle Lot  M Frame,Pre-Owned,$149.00,"Sold  Dec 9, 2023Sold Item",,Yes,No
OAKLEY M-FRAME OO 11-162 Matte Black / Grey Shield Sunglasses NWT AUTH,Brand New,$89.99,"Sold  Dec 9, 2023Sold Item",,Yes,No
Oakley M Frame Pro Matte Black - Frame Only - NEAR MINT,Pre-Owned,$119.99,"Sold  Dec 9, 2023Sold Item",,No,Yes
Oakley M frame heater carbon fiber like frames + new grey lens REDUCED 20$,Pre-Owned,$155.00,"Sold  Dec 9, 2023Sold Item",,No,Yes
Oakley M2 Frame Men's Wrap Sunglasses Menâ€™s Pre Owned,Pre-Owned,$39.99,"Sold  Dec 9, 2023Sold Item",,Yes,No
Oakley M2 Frame XL Sunglasses OO9343-05 Polished White Frame Fire Iridium Lenses,Pre-Owned,$50.00,"Sold  Dec 9, 2023Sold Item",3 bids,No,No
Galaxy Replacement Clip Rubber Kit For Oakley Si Ballistic M Frame 2.0 3.0 Black,New (Other),$7.97,"Sold  Dec 9, 2023Sold Item",,Yes,No
NEW OAKLEY SI Ballistic Sun Glasses M Frame 2.0 Array Strike Clear & Gray APEL,Brand New,$89.99,"Sold  Dec 9, 2023Sold Item",,Yes,No
Oakley M2 Frame 0OO9212 Sunglasses Polished Black IRIDIUM Sports,Brand New,$89.97,"Sold  Dec 9, 2023Sold Item",,Yes,No
Oakley SI Ballistic M Frame 3.0 Multicam frame only 009146,New (Other),$79.00,"Sold  Dec 9, 2023Sold Item",,Yes,No
Oakley Standard Issue Ballistic M Frame 2.0 Men's Sunglasses - Black/Clear,New (Other),$85.00,"Sold  Dec 9, 2023Sold Item",,Yes,No
Oakley M2 FRAME XL polished black/grey OO9343-01 sunglasses NEW IN BOX!,Brand New,$84.99,"Sold  Dec 9, 2023Sold Item",,Yes,No
Custom Oakley M Frame 3.0 Sunglasses Black & White Splatter with Chrome Lenses,Pre-Owned,$149.00,"Sold  Dec 9, 2023Sold Item",,No,Yes
"Oakley Industrial M-Frame 2.0 Sunglasses Safety, Shooting, Riding Glasses +Clear",New (Other),$129.89,"Sold  Dec 9, 2023Sold Item",,Yes,No
Oakley SI Ballistic M Frame 3.0 Matte Black Z87 Clear & Gray Lenses 0OO9146 NIB,Brand New,$139.99,"Sold  Dec 9, 2023Sold Item",,Yes,No
Galaxy Replacement Lens For Oakley Si Ballistic M Frame 2.0 Z87 Multi-Selection,New (Other),$5.91 to $21.98,"Sold  Dec 9, 2023Sold Item",,Yes,No
Wholesale POLARIZED Replacement Lens for-Oakley M Frame Hybrid Vented Sunglasses,Brand New,$6.95,"Sold  Dec 8, 2023Sold Item",,Yes,No
Oakley KATO Sunglasses OO9455M-0249 Polished Black Frame W/ PRIZM 24K Lens NEW,Brand New,$199.99,"Sold  Dec 8, 2023Sold Item",,Yes,No
"Oakley SI Ballistic M Frame 3.0  Black. Clear, Grey,& Persimmon Lenses OO9146-04",Brand New,$120.00,"Sold  Dec 8, 2023Sold Item",1 bid,No,No
Oakley M2 Frame XL Sunglasses OO9343-21 Polished Black W/ PRIZM Sapphire Lens,Brand New,$99.99,"Sold  Dec 8, 2023Sold Item",,Yes,No
Oakley M Frame Red Iridium Replacement Lens Gen 1 RARE,Pre-Owned,$85.00,"Sold  Dec 8, 2023Sold Item",,No,Yes
Galaxy Replacement Lens For Oakley Si Ballistic M Frame 3.0 Z87 Multi-Selection,New (Other),$5.91 to $23.28,"Sold  Dec 8, 2023Sold Item",,Yes,No
Oakley M Frame 2.0 Strike SI Prizm Grey Replacement Lens Authentic Military Z87,New (Other),$49.99,"Sold  Dec 8, 2023Sold Item",,Yes,No
Nose Pads+Earsocks Rubber Kits 4 Oakley M Frame Sweep/Strike/Hybrid/Heater Black,New (Other),$9.88,"Sold  Dec 8, 2023Sold Item",,Yes,No
Oakley Standard Issue Ballistic M Frame 2.0 Men's Sunglasses - Black/Clear. FS,Brand New,$99.99,"Sold  Dec 8, 2023Sold Item",,No,Yes
OAKLEY M2 FRAME XL CUSTOM MATTE BLACK ORANGE FIRE IRIDIUM SUNGLASSES OO9343 NEW,New (Other),$160.00,"Sold  Dec 8, 2023Sold Item",,Yes,No
Oakley M Frame Black Camo Sunglasses Brown Reflective Lens,Pre-Owned,$49.95,"Sold  Dec 8, 2023Sold Item",,No,Yes
Oakley SI Ballistic M-FRAME 3.0 BONE/Coyote Tan Laser/CLR/GRY/PRISM Lense,Brand New,$199.99,"Sold  Dec 8, 2023Sold Item",,Yes,No
Oakley OO9047 SI Ballistic M Frame 2.0 Strike Shield Glasses,Brand New,$75.00,"Sold  Dec 7, 2023Sold Item",,Yes,No
Oakley M Frame Pro Jet Black Sunglasses - Black Iridium Heater - NEAR MINT,Pre-Owned,$179.99,"Sold  Dec 8, 2023Sold Item",,Yes,No
Oakley M Frame Black Sunglasses,Pre-Owned,$64.99,"Sold  Dec 8, 2023Sold Item",,Yes,No
Oakley M Frame Joker Green Sunglasses - Gold Iridium Hybrid,Pre-Owned,$139.99,"Sold  Nov 28, 2023Sold Item",,No,Yes
Oakley M2 Frame 009343-2045 Men's Black Frame Polarized Prizm Lens Sunglasses,Pre-Owned,$79.99,"Sold  Dec 8, 2023Sold Item",,No,Yes
Galaxy Nose Pads Rubber Kits For Oakley Si Ballistic M Frame 2.0 Z87 Black,New (Other),$5.19,"Sold  Dec 8, 2023Sold Item",,Yes,No
Oakley Pro M Frame Heater & Strike Black Iridium Lenses,Pre-Owned,$160.00,"Sold  Dec 7, 2023Sold Item",1 bid,No,No
Oakley SI Ballistic M Frame Alpha & Halo Goggle Multi-Lens Kit 00926-1144,New (Other),$100.00,"Sold  Dec 7, 2023Sold Item",,Yes,No
Oakley S.I. Ballistic M Frame Clear and Grey lens,Brand New,$100.00,"Sold  Dec 7, 2023Sold Item",,Yes,No
Oakley SI Ballistic M Frame 3.0 Matte Black Clear & Gray Lenses New W/Case Z87,Brand New,$89.00,"Sold  Dec 7, 2023Sold Item",,Yes,No
OAKLEY SI M FRAME 2.0 BALLISTIC EXTRA CLEAR LENS WITH EVERYTHING SUNGLASSES,Pre-Owned,$139.99,"Sold  Dec 7, 2023Sold Item",,Yes,No
Oakley M Frame Carbon Fiber Half Rim Wrap Sunglasses Frames 130 Sports Men Women,Pre-Owned,$79.99,"Sold  Dec 7, 2023Sold Item",,Yes,No
Oakley New M Frame Joker Green w/ Gold Iridium Hybrid Lenses,Pre-Owned,$125.00,"Sold  Dec 6, 2023Sold Item",,No,Yes
Oakley SI Ballistic M Frame 3.0 Gray Lens Multicam Sunglasses SAME DAY SHIPPING,Brand New,$115.50,"Sold  Dec 6, 2023Sold Item",,Yes,No
Oakley SI Ballistic M Frame 2.0 Strike Safety Glasses Kit,Pre-Owned,$79.99,"Sold  Dec 6, 2023Sold Item",,Yes,No
GENUINE OAKLEY M-FRAME BLACK EAR SOCKS TEMPLE TIPS & NOSE PADS 06-596,Brand New,$17.95,"Sold  Dec 6, 2023Sold Item",,Yes,No
Oakley Sunglasses Origins M2 Frame XL Carbon Fiber Prizm Road Iridium  OO9343-16,Brand New,$127.30,"Sold  Dec 6, 2023Sold Item",,Yes,No
Galaxy Replacement Lenses For Oakley M Frame Sweep Sunglasses Titanium Polarized,New (Other),$7.95,"Sold  Dec 6, 2023Sold Item",,Yes,No
OAKLEY M Frame Sweep Strap 1.0 2.0 3.0 Strike M2 Hybrid.,Brand New,$99.99,"Sold  Dec 6, 2023Sold Item",,Yes,No
Wholesale POLARIZED Replacement Lens for-Oakley M Frame Heater Vented Sunglasses,Brand New,$6.95,"Sold  Dec 6, 2023Sold Item",,Yes,No
Shop on eBay,Brand New,$20.00,,,Yes,No
oakley m2 frame sunglasses,Pre-Owned,$45.00,"Sold  Dec 6, 2023Sold Item",4 bids,No,No
[OO9343-08] Mens Oakley M2 Frame XL Sunglasses,Brand New,$107.99,"Sold  Dec 6, 2023Sold Item",,Yes,No
Oakley SI Ballistic M Frame 2.0 Strike Safety Glasses Kit,New (Other),$80.00,"Sold  Dec 6, 2023Sold Item",,No,Yes
Oakley SI Ballistic M Frame 2.0 Strike Safety Shooting Glasses Kit,New (Other),$90.00,"Sold  Dec 6, 2023Sold Item",,Yes,No
Oakley M Frame Strike OO 9060 11-161  Black / Clear Shield Men's Sunglasses NWT,Brand New,$99.99,"Sold  Dec 6, 2023Sold Item",,Yes,No
Oakley KATO Sunglasses OO9455M-2449 Cavendish White Frame W/ PRIZM 24K Lens,Pre-Owned,$139.99,"Sold  Dec 5, 2023Sold Item",,Yes,No
Oakley M Frame Matte Black Frame w/ Satin Silver Oakley Icons & Nose Guard,Pre-Owned,$74.98,"Sold  Dec 5, 2023Sold Item",,Yes,No
Oakley M Frame Pro Matte Black - VR28 Iridium Vented Strike - VERY NICE,Pre-Owned,$81.00,"Sold  Dec 5, 2023Sold Item",2 bids,No,No
Sunglasses Frames-Oakley M2 OO9212 OO9254 XL OO9343 OO9345 Incl Temples Earsocks,Brand New,$89.99,"Sold  Dec 5, 2023Sold Item",,Yes,No
AUTHENTIC OAKLEY M-FRAME BLACK EAR SOCKS TEMPLE TIPS & NOSE PAD KIT NEW! 06-596,Brand New,$19.99,"Sold  Dec 5, 2023Sold Item",,Yes,No
Oakley M Frame (New Gen) Crystal Red - LEFT ARM ONLY - MINT,Pre-Owned,$29.99,"Sold  Dec 5, 2023Sold Item",,Yes,No
Oakley SI Ballistic M Frame 3.0 Tactical Sunglasses Wind Dust Gasket New,Brand New,$75.00,"Sold  Dec 5, 2023Sold Item",,Yes,No
Oakley Standard Issue Ballistic M Frame 2.0 Men's Sunglasses - Black/Clear,New (Other),$95.00,"Sold  Dec 5, 2023Sold Item",,No,Yes
Sunglasses Frames-Oakley OO9212 OO9254 XL OO9343 OO9345 M2 Incl Temples Earsocks,Brand New,$89.99,"Sold  Dec 5, 2023Sold Item",,Yes,No
NEW Oakley SI Ballistic M Frame Replacement Lens Hybrid Gray In Box,Brand New,$29.99,"Sold  Dec 5, 2023Sold Item",1 bid,No,Yes
Vintage Original Oakley High Definition Optics Sunglasses Case Floating M Frame,Pre-Owned,$50.00,"Sold  Dec 5, 2023Sold Item",,No,Yes
"Men's Oakley M Frame Sunglasses Black Frame Smoke Lenses WITH Extra Lens, Nose",Pre-Owned,$85.00,"Sold  Dec 5, 2023Sold Item",,Yes,No
Oakley Mumbo M Frame Hammers Strike ST K Cobalt POS Red 4.674.851 4.867.550,Brand New,$328.50,"Sold  Dec 5, 2023Sold Item",,No,Yes
Oakley M Frame Matte Black Frame w/ Satin Silver Oakley Icons - Used / *NR MINT,Pre-Owned,$89.95,"Sold  Dec 5, 2023Sold Item",,Yes,No
Oakley Terrain Tan Frame with Grey Prizm and Clear Lenses OO9296-1944,Brand New,$219.95,"Sold  Dec 5, 2023Sold Item",,Yes,No
Galaxy Replacement Lenses For Oakley M Frame Sweep Sunglasses Red Polarized,New (Other),$8.49,"Sold  Dec 5, 2023Sold Item",,Yes,No
Oakley M-Frame Green Frame Polarized Lenses Sunglasses Cycling USA Made Vintage,Pre-Owned,$90.00,"Sold  Dec 5, 2023Sold Item",,No,Yes
Oakley Black  M Frame Sunglasses Gen 1 Vintage 1989 (Read Description),Pre-Owned,$64.99,"Sold  Dec 4, 2023Sold Item",,No,Yes
Galaxy Lenses + Nose Pad + Earsock For Oakley Si Ballistic M Frame 2.0 Z87 Black,New (Other),$16.98,"Sold  Dec 4, 2023Sold Item",,Yes,No
Oakley Standard Issue Ballistic M Frame 2.0 Men's Sunglasses - Grey/Clear Lens,Brand New,$70.00,"Sold  Dec 4, 2023Sold Item",,No,Yes
Oakley M2 Frame XL Polished Black Grey Socks Replacement Frame Only Authentic,New (Other),$74.99,"Sold  Dec 4, 2023Sold Item",,Yes,No
OAKLEY SI  (Two Lens) BALLISTIC M FRAME ALPHA  APEL safety glasses OO9296-10 USA,Pre-Owned,$79.99,"Sold  Dec 4, 2023Sold Item",,No,Yes
OAKLEY SI  (Two Lens) BALLISTIC M FRAME ALPHA  APEL safety glasses OO9296-10 USA,Brand New,$89.95,"Sold  Dec 3, 2023Sold Item",1 bid,No,No
OAKLEY SI  (Two Lens) BALLISTIC M FRAME ALPHA  APEL safety glasses OO9296-10 USA,Brand New,$91.00,"Sold  Dec 3, 2023Sold Item",2 bids,No,No
Oakley Magnesium (Mag) M Frame Denim - Black Iridium Strike - VERY NICE,Pre-Owned,$204.49,"Sold  Dec 3, 2023Sold Item",15 bids,No,No
Oakley M Frame Sunglasses used,Pre-Owned,$102.50,"Sold  Dec 3, 2023Sold Item",19 bids,No,No
Oakley Elmont M OO4119 0958 Prizm Matte Silver Aviator Frames 58/15 Sunglasses,Pre-Owned,$31.76,"Sold  Dec 3, 2023Sold Item",11 bids,No,No
OAKLEY M FRAME REPACEMENT SUNGLASSES LENS IN ORIGINAL BOX,Pre-Owned,$29.99,"Sold  Dec 3, 2023Sold Item",1 bid,No,No
Oakley PRO M Frame Golf Gold/ Vented Gold Iridium Sweep *Great Condition*,Pre-Owned,$74.99,"Sold  Dec 3, 2023Sold Item",,No,Yes
NEW OAKLEY M2 FRAME XL SUNGLASSES POLISHED BLACK FRAME W/ GREY LENS SHIELD,Brand New,$89.99,"Sold  Dec 3, 2023Sold Item",,Yes,No
Oakley SI Ballistic M Frame Sport Glasses,New (Other),$41.00,"Sold  Dec 3, 2023Sold Item",2 bids,No,No
BRAND NEW In Box CUSTOM Oakley M2 Carbon Fiber Frame Prizm Ice,Brand New,$100.00,"Sold  Dec 3, 2023Sold Item",5 bids,No,No
oakley m frame sunglasses,New (Other),$58.00,"Sold  Dec 3, 2023Sold Item",19 bids,No,No
Oakley Sports Sunglasses M Frame Good condition Free shipping Rare #883,Pre-Owned,$91.58,"Sold  Dec 3, 2023Sold Item",,Yes,No
Galaxy Nose Pads Rubber Kits For Oakley M2 Frame Sunglasses Black,New (Other),$4.95,"Sold  Dec 3, 2023Sold Item",,Yes,No
Oakley Custom Radarlock Pitch Carbon Fiber Fire Iridium Mens Sports Sunglasses,New (Other),$125.14,"Sold  Dec 3, 2023Sold Item",,Yes,No
Oakley SI Ballistic M Frame Strike Safety Shooting Glasses Kit w/ Dark and Clear,Pre-Owned,$69.99,"Sold  Dec 3, 2023Sold Item",1 bid,No,Yes
Oakley Sunglasses Holbrook OO9102-M555 Black Red Frames NFL Kansas City Chiefs,New (Other),$119.99,"Sold  Dec 2, 2023Sold Item",,Yes,No
Galaxy Earsock Rubber Kits For Oakley Si Ballistic M Frame 3.0 Z87 Black,New (Other),$5.95,"Sold  Dec 2, 2023Sold Item",,Yes,No
Galaxy Replacement Clip Rubber Kits For Oakley Si M Frame 2.0/ 3.0 Black,New (Other),$7.17,"Sold  Dec 2, 2023Sold Item",,Yes,No
Galaxy Nose Pads Rubber Kits For Oakley M2 Frame XL Sunglasses Black,New (Other),$4.46,"Sold  Dec 2, 2023Sold Item",,Yes,No
Oakley SI Ballistic M Frame 3.0 Array Sunglasses w/Multi-Lens Kit,Pre-Owned,$70.00,"Sold  Dec 2, 2023Sold Item",,Yes,No
Galaxy Nose Pads Rubber Kits For Oakley M2 Frame Sunglasses Blue,New (Other),$4.95,"Sold  Dec 2, 2023Sold Item",,Yes,No
Oakley M2 FRAME XL polished black/grey OO9343-01 sunglasses NEW IN BOX!,Brand New,$84.99,"Sold  Dec 2, 2023Sold Item",,Yes,No
"NEW Oakley M Frame 2.0 SI (Strike) Sunglasses, Ballistic Black / Grey 11-140",New (Other),$70.99,"Sold  Dec 2, 2023Sold Item",,Yes,No
[OO9343-09] Mens Oakley M2 Frame XL Polarized Sunglasses,Brand New,$129.99,"Sold  Dec 2, 2023Sold Item",,Yes,No
"Oakley Pro M Frame Sunglasses Black Frames with 4 Lenses, and Hard Case",Pre-Owned,$99.00,"Sold  Dec 2, 2023Sold Item",9 bids,No,No
Oakley Ballistic M FrameÂ® Alpha Array,Pre-Owned,$199.99,"Sold  Dec 1, 2023Sold Item",,Yes,No
Sweep Oakley M Frames Pro Platinum/Gold Iridium Sunglasses,Pre-Owned,$169.99,"Sold  Dec 1, 2023Sold Item",,Yes,No
NEW OAKLEY SI M FRAME Z87 PHOTOCHROMIC BLACK MULTI LENS KIT SUNGLASSES 150 MM,New (Other),$255.00,"Sold  Dec 1, 2023Sold Item",,Yes,No
Oakley David Duvall Signature Series Pro M Frame Black Chrome Vntage Sun Glasses,Pre-Owned,$187.50,"Sold  Dec 1, 2023Sold Item",34 bids,No,No
WL Yellow Replacement Lenses and Black Rubber Kit Set 4 Oakley M Frame Sweep,Brand New,$21.99,"Sold  Dec 1, 2023Sold Item",,Yes,No
"Oakley Pro M Frame Sunglasses Black Frames with 4 Lenses, and Hard Case",Pre-Owned,$128.00,"Sold  Dec 1, 2023Sold Item",3 bids,No,No
Oakley Sunglasses M2 Frame OO9212 0139 Polished Black Black Iridium NIB 01 39,Brand New,$94.99,"Sold  Dec 1, 2023Sold Item",,Yes,No
Oakley Standard Issue Ballistic APEL M 2.0 Black Sunglasses Frame/Nose Clip Only,Pre-Owned,$59.95,"Sold  Dec 1, 2023Sold Item",,Yes,No
Shop on eBay,Brand New,$20.00,,,Yes,No
Oakley SI Ballistic M Frame 2.0 (OO9213) - FRAME ONLY (No Lenses) BNIB Authentic,Brand New,$53.19,"Sold  Dec 1, 2023Sold Item",,Yes,No
New OAKLEY BALLISTIC M-FRAME Safety glasses 11-161 Black w/Clear ANSI Z87.1 Lens,Brand New,$149.99,"Sold  Dec 1, 2023Sold Item",,Yes,No
Oakley M Frame FMJ Red Black Iridium Heater+Hard Case 09-141 NEW,New (Other),$375.00,"Sold  Dec 1, 2023Sold Item",,Yes,No
Oakley Pro M Frame Earsocks Ear Pad  Kit Nosepiece Black Sunglasses Rubbers New,Brand New,$23.99,"Sold  Nov 30, 2023Sold Item",,Yes,No
Oakley M Frame G30 Iridium Vented Heater Lens - MINT,Pre-Owned,$119.99,"Sold  Nov 30, 2023Sold Item",,No,Yes
New In Box OAKLEY MFRAME/PRO M FRAME STRIKE CLEAR REPLACEMENT LENS NOT M2,Brand New,$22.50,"Sold  Nov 30, 2023Sold Item",,Yes,No
OAKLEY M2 FrameÂ® XL Replacement Lens Fire Iridium Polarized Lenses 101-649-012,Pre-Owned,$55.00,"Sold  Nov 30, 2023Sold Item",,Yes,No
Oakley M Frame Sport Sunglasses Red Frame Menâ€™s Clear Lenses,Pre-Owned,$71.00,"Sold  Nov 30, 2023Sold Item",13 bids,No,No
Oakley M2 Frame Sunglasses OO9212-04 Silver/Fire Iridium Lens Oakley Sunglasses,Brand New,$99.99,"Sold  Nov 30, 2023Sold Item",,Yes,No
Yellow Oakley M Frame Sunglasses Preowned,Pre-Owned,$40.00,"Sold  Nov 30, 2023Sold Item",,Yes,No
Vintage Oakley M Frame? Gen 2 Yellow Sunglasses Sweep Nice Preowned Used,Pre-Owned,$89.99,"Sold  Nov 30, 2023Sold Item",,Yes,No
Oakley Standard issue SI Ballistic M Frame Z87 Black Sunglasses + Lens And Case,Pre-Owned,$70.00,"Sold  Nov 30, 2023Sold Item",,Yes,No
"Original Oakley M Frame Black Sunglasses Extra Lense* With Case, See Pics",Pre-Owned,$79.95,"Sold  Nov 29, 2023Sold Item",,Yes,No
"Oakley M Frame Sunglasses, Grey Frame, Orange Iridium Lens",Pre-Owned,$59.95,"Sold  Nov 29, 2023Sold Item",,Yes,No
Oakley SI Ballistic M Frame 2.0- Clear Lense/ Case/ Oakley Leash,Pre-Owned,$51.00,"Sold  Nov 29, 2023Sold Item",3 bids,No,No
Oakley SI Ballistic M Frame 2.0 Strike Array Frame Black Lense Clear Grey 11-138,Brand New,$66.00,"Sold  Nov 29, 2023Sold Item",8 bids,No,No
Oakley Men's 11-161 M Frame Strike Non-Polarized OO9060 - Black Clear Lenses,New (Other),$92.01,"Sold  Nov 29, 2023Sold Item",,Yes,No
Galaxy Earsocks Rubber Kits For Oakley M Frame Strike/Sweep/Heater/Hybrid Black,New (Other),$5.95,"Sold  Nov 29, 2023Sold Item",,Yes,No
Oakley Pro M Frame Heater & Strike Black Iridium Lenses,Pre-Owned,$160.00,"Sold  Nov 29, 2023Sold Item",1 bid,No,No
OAKLEY ELMONT M LEAD FRAME ONLY SUNGLASSES,Pre-Owned,$40.00,"Sold  Nov 29, 2023Sold Item",,Yes,No
OAKLEY SI M FRAME 2.0 STRIKE CLEAR REPLACEMENT LENS AUTHENTIC Z87 MILITARY,New (Other),$34.99,"Sold  Nov 29, 2023Sold Item",,Yes,No
Oakley M2 Frame Sunglasses OO9212-04 Silver/Fire Iridium,Pre-Owned,$75.00,"Sold  Nov 29, 2023Sold Item",,No,Yes
Oakley Sunglasses M2 Frame XL OO9343-21 Polished Black Prizm Sapphire,Brand New,$130.00,"Sold  Aug 29, 2021Sold Item",,Yes,No
OAKLEY USA Vintage M FRAME Wrap Shield Black Clear Sports Sunglasses 129 mm,Pre-Owned,$79.59,"Sold  Nov 28, 2023Sold Item",,Yes,No
Oakley Standard Issue SI Ballistic M Frame 2.0 Z87 Black Safety Glasses - READ,Pre-Owned,$49.99,"Sold  Nov 28, 2023Sold Item",,Yes,No
Oakley SI Ballistic M Frame Alpha & Halo Goggle Multi-Lens Kit 00926-1144,Pre-Owned,$150.00,"Sold  Nov 28, 2023Sold Item",5 bids,No,No
Oakley M2 Frame 009343-2045 Men's Black Frame Polarized Prizm Lens Sunglasses,Pre-Owned,$67.99,"Sold  Nov 28, 2023Sold Item",,Yes,No
Oakley SI M FRAME 2.0 Glasses | 9213-03 Matte Black/ANSI Z87.1 Grey Lens w/ Case,Pre-Owned,$64.95,"Sold  Nov 28, 2023Sold Item",,Yes,No
OAKLEY M-FRAME METALLIC RED FRAME W/BLACK IRIDIUM HYBRID LENSES SUNGLASSES,Pre-Owned,$174.99,"Sold  Nov 28, 2023Sold Item",,No,Yes
Galaxy Nose Pads For Oakley M Frame Sweep/Strike/Hybrid/Heater Razor Blade Black,New (Other),$5.75,"Sold  Nov 28, 2023Sold Item",,Yes,No
ðŸŒŸ Vtg Auth Oakley M Frame Brown Ear Socks & Black Nosepiece Sunglasses Rubber,Pre-Owned,$11.95,"Sold  Nov 28, 2023Sold Item",,Yes,No
USGI Oakley M Frame SI 2.0 Ballistic Glasses Eye Pro Clamshell Storage Case,Pre-Owned,$14.99,"Sold  Nov 27, 2023Sold Item",,No,Yes
Galaxy Earsock Rubber Kits For Oakley Si Ballistic M Frame 3.0 Z87 Black,New (Other),$5.95,"Sold  Nov 28, 2023Sold Item",,Yes,No
Oakley SI M Frame Shooting Glasses Sunglasses & Clear Lens Case & Papers,Pre-Owned,$76.50,"Sold  Nov 28, 2023Sold Item",,Yes,No
Oakley M2 Frame XL POLARIZED Sunglasses OO9343 Matte Black Prizm Black Polarized,Brand New,$115.00,"Sold  Nov 28, 2023Sold Item",,No,Yes
OAKLEY M Frame Sweep Strap 1.0 2.0 3.0 Strike M2 Hybrid..,Brand New,$71.00,"Sold  Nov 27, 2023Sold Item",2 bids,No,No
Oakley SI Ballistic M Frame 3.0 Array Sunglasses w/Multi-Lens Kit Tan oo9146-08,Brand New,$223.00,"Sold  Nov 27, 2023Sold Item",,Yes,No
New Oakley SI Ballistic M Frame 2.0 Strike Safety Shooting Glasses Kit - 11-138,Brand New,$119.95,"Sold  Nov 27, 2023Sold Item",,Yes,No
NEW 100% Authentic Oakley M Frame Pro Microfiber Bag,New (Other),$50.00,"Sold  Nov 27, 2023Sold Item",,Yes,No
Oakley Black M Frame Sport Glasses,New (Other),$75.00,"Sold  Nov 27, 2023Sold Item",,Yes,No
Oakley M Frame USA Black Sunglasses MG,Pre-Owned,$50.00,"Sold  Nov 27, 2023Sold Item",,Yes,No
Oakley M Frame Sport Sunglasses Blue Frame Menâ€™s Black Lenses Dodger Blue,Pre-Owned,$102.50,"Sold  Nov 27, 2023Sold Item",33 bids,No,No
Oakley M Frame Z87 Sunglasses Clear & Black Shield Lenses w/ Case,Pre-Owned,$49.99,"Sold  Nov 27, 2023Sold Item",,Yes,No
Original Oakley M Frame Rootbeer Sunglasses,Pre-Owned,$61.00,"Sold  Nov 27, 2023Sold Item",7 bids,No,No
Vintage Oakley M Frame Black Frame Smoke / Gray Lens Made in USA,Pre-Owned,$71.00,"Sold  Nov 27, 2023Sold Item",7 bids,No,No
Oakley M2 FRAME XL polished black/grey OO9343-01 sunglasses NEW IN BOX!,Brand New,$74.99,"Sold  Nov 27, 2023Sold Item",1 bid,No,Yes
NEW OAKLEY SI Ballistic Sun Glasses M Frame 2.0 Array Strike Clear & Gray APEL,New (Other),$74.00,"Sold  Nov 27, 2023Sold Item",,Yes,No
M2 Frame:  Orange Flare Lens:  Prizm Ruby Polarized Icon:  Gold Shiney,New (Other),$56.00,"Sold  Nov 27, 2023Sold Item",8 bids,No,No
Oakley M Frame Matte Black Grey Sweep Mumbo Gen 1 09-510+Hard Case Vintage,Pre-Owned,$279.99,"Sold  Nov 27, 2023Sold Item",,Yes,No
ðŸŒŸVintage Auth Oakley M Frame Gray Ear Socks & Black Nosepiece Sunglasses Rubber,Pre-Owned,$12.50,"Sold  Nov 26, 2023Sold Item",3 bids,No,No
Oakley M2 OO9343 1945 Matte Black Prizm Polarized M Frames,Pre-Owned,$57.00,"Sold  Nov 26, 2023Sold Item",,No,Yes
Oakley SI M Frame 2.0 OO9047-0133 Men's Matte Black Eyeglasses Frame Only,Pre-Owned,$49.99,"Sold  Nov 26, 2023Sold Item",,No,Yes
Oakley M Frame Gray & Black Frame Sunglasses Light Scratches Missing Nose Piece,Pre-Owned,$40.00,"Sold  Nov 26, 2023Sold Item",,No,Yes
Oakley Sunglasses M Frame Heater Lenses Vintage 1990s,Pre-Owned,$199.98,"Sold  Nov 26, 2023Sold Item",,Yes,No
Oakley Standard issue SI Ballistic M Frame Z87 Black Sunglasses + Lens And Case,Pre-Owned,$50.00,"Sold  Nov 26, 2023Sold Item",1 bid,No,No
Oakley Standard Issue Ballistic M Frame 2.0 Men's Sunglasses - Black/Clear,Brand New,$70.00,"Sold  Nov 26, 2023Sold Item",,No,Yes
Oakley M Frame Sport Sunglasses Blue Frame Mens Multi Colored Lenses With Case,Pre-Owned,$75.00,"Sold  Nov 26, 2023Sold Item",,No,Yes
Oakley SI Ballistic M Frame 3.0 Tactical Sunglasses Wind Dust Gasket New,Brand New,$75.00,"Sold  Nov 26, 2023Sold Item",,No,Yes
Oakley SI M Frame 2.0 Matte Black Ballistic Sunglasses Clear Lens,Pre-Owned,$70.99,"Sold  Nov 25, 2023Sold Item",,Yes,No
Oakley M Frame Black Glasses - preowned,Pre-Owned,$60.00,"Sold  Nov 25, 2023Sold Item",,Yes,No
Shop on eBay,Brand New,$20.00,,,Yes,No
Oakley Sport Sunglasses,Pre-Owned,$25.00,"Sold  Nov 25, 2023Sold Item",1 bid,No,Yes
Oakley Men's 11-161 M Frame Strike Non-Polarized OO9060 - Black Clear Lenses,New (Other),$92.08,"Sold  Nov 23, 2023Sold Item",,No,Yes
Oakley M Frame Black Iridium Vented Sweep Lens - VERY NICE,Pre-Owned,$49.99,"Sold  Nov 25, 2023Sold Item",,Yes,No
Oakley M Frame Pro Shooting Pack,Pre-Owned,$133.74,"Sold  Nov 25, 2023Sold Item",4 bids,No,No
Oakley Pro M Frame Sunglasses Yellow Frame with 2 Lenses and Hard Case,Pre-Owned,$107.50,"Sold  Nov 25, 2023Sold Item",10 bids,No,No
Oakley M2 Frame OO9212-07 Men's Navy Blue Frame w/Gray Polarized Lens Sunglasses,Pre-Owned,$69.99,"Sold  Nov 25, 2023Sold Item",1 bid,No,No
RARE COLOR Oakley Sport Iridium HT G30 Replacement Lens 08-1014 + 02-0415 Gold M,Pre-Owned,$60.00,"Sold  Nov 24, 2023Sold Item",1 bid,No,No
New In Box Oakley SI Ballistic M Frame 3.0 Gray Lens Multicam Sunglasses,Brand New,$75.00,"Sold  Nov 24, 2023Sold Item",,Yes,No
Oakley Sunglasses PRO M-Frame Olive Green Frame Black Polarized Lenses Very Good,Pre-Owned,$94.99,"Sold  Nov 24, 2023Sold Item",,No,Yes
Oakley USA M Frame Black Sunglasses G7,Pre-Owned,$36.00,"Sold  Nov 24, 2023Sold Item",,Yes,No
[OO9213-03] Mens Oakley Industrial M-Frame 2.0 Sunglasses,Brand New,$97.99,"Sold  Nov 24, 2023Sold Item",,Yes,No
Oakley Elite Special Forces S.I. Ballistic M Frame 2.0 Mens Sunglasses-Blk/Clear,Brand New,$90.00,"Sold  Nov 24, 2023Sold Item",,Yes,No
Oakley M2 Frame Sunglasses OO9212-04 Silver/Fire Iridium,Pre-Owned,$75.00,"Sold  Nov 24, 2023Sold Item",,No,Yes
Oakley M2 Frame XL Polished White Black Socks Replacement Frame Only Authentic,New (Other),$74.99,"Sold  Nov 24, 2023Sold Item",,Yes,No
Oakley Sunglasses M2 Frame XL OO9343-08 Polished Black Prizm Road,Brand New,$106.99,"Sold  Nov 23, 2023Sold Item",,Yes,No
Oakley M Frame Gold Mine w/ Gold Iridium Sunglasses,Pre-Owned,$130.00,"Sold  Nov 23, 2023Sold Item",1 bid,No,No
Oakley Pro M Frame Array Ballistic Hard Storage Case Black 07-004 RARE Good Used,Pre-Owned,$69.99,"Sold  Nov 23, 2023Sold Item",,Yes,No
Oakley Standard Issue Ballistic M Frame 2.0 Men's Sunglasses - Grey/Clear Lens,Brand New,$75.00,"Sold  Nov 23, 2023Sold Item",,Yes,No
Oakley Mens Black M-Frame Polarized Sunglasses,Pre-Owned,$95.00,"Sold  Nov 23, 2023Sold Item",,Yes,No
"Oakley M Frame Lenses, vintage 1990s Oakley, authentic! Has scratches",Pre-Owned,$49.99,"Sold  Nov 23, 2023Sold Item",,No,Yes
Oakley M2 Frame XL Fire Iridium Replacement Lens Authentic Red Yellow,New (Other),$74.99,"Sold  Nov 22, 2023Sold Item",,Yes,No
Oakley M Frame Blue W/Black Iridium Lenses,Pre-Owned,$109.99,"Sold  Nov 22, 2023Sold Item",,Yes,No
NEW Oakley SI Ballistic M-Frame 2.0 Black Frame w/ Clear & Dark Lens,Brand New,$64.95,"Sold  Nov 22, 2023Sold Item",1 bid,No,No
OAKLEY SI  (Two Lens) BALLISTIC M FRAME ALPHA  APEL safety glasses OO9296-10 USA,Brand New,$126.00,"Sold  Nov 22, 2023Sold Item",8 bids,No,No
Oakley M Frame Sport Sunglasses Red Frame Menâ€™s Clear Lenses,Pre-Owned,$63.00,"Sold  Nov 22, 2023Sold Item",19 bids,No,No
