title,condition,price,sold_date,num_bids,buy_it_now,best_offer
"OAKLEY SI BALLISTIC M-FRAME 2.0 SUNGLASSES AND SI BALLISTIC  GOGGLES ,USASOC KIT",Brand New,$339.99,"Sold  Oct 31, 2023Sold Item",,No,Yes
Oakley Pro M Frame Golf Jet Black (Sweep Vented) / G30 Iridium 06-987 from 1997,Pre-Owned,$79.00,"Sold  Oct 31, 2023Sold Item",1 bid,No,No
NEW USMC OAKLEY SI Ballistic Sun Glasses M Frame 2.0 Array Strike Clear & Gray,New (Other),$67.99,"Sold  Oct 31, 2023Sold Item",,No,Yes
Oakley SI Ballistic M Frame Alpha Coyote Frame + 2 Lenses - Awesome!,Pre-Owned,$119.00,"Sold  Oct 31, 2023Sold Item",1 bid,No,Yes
Oakley M2 Frame Silver Size M Universal Fit Fire Iridium 9212-04 Barely Used,Pre-Owned,$59.00,"Sold  Oct 31, 2023Sold Item",1 bid,No,No
Oakley Standard Issue Ballistic M Frame 2.0 Men's Sunglasses - Black/Clear,Brand New,$71.00,"Sold  Oct 30, 2023Sold Item",8 bids,No,No
Shop on eBay,Brand New,$20.00,,,Yes,No
Oakley SI M Frame Ballistic Apel Approved 2.0 Strike Gray Clear,New (Other),$89.99,"Sold  Oct 30, 2023Sold Item",,Yes,No
OAKLEY SI BALLISTIC M FRAME 09296 ALPHA TERRAIN TAN SUNGLASSES NEW,New (Other),$125.00,"Sold  Oct 30, 2023Sold Item",,Yes,No
Oakley Sunglasses M Frame Crystal Red/ Gray Rare!! VGC!!!,New (Other),$179.00,"Sold  Oct 30, 2023Sold Item",,Yes,No
OAKLEY U.S. Military Recommended SI Series M Frame 2.0 Military Sunglasses,Pre-Owned,$108.00,"Sold  Oct 29, 2023Sold Item",,No,Yes
Galaxy Replacement Lenses For Oakley M 2 Frame XL Photochromic Transition,New (Other),$10.15,"Sold  Oct 29, 2023Sold Item",,Yes,No
Oakley M Frame Gold Mine w/ Hybrid + Red Iridium Sunglasses,New (Other),$165.50,"Sold  Oct 29, 2023Sold Item",12 bids,No,No
OAKLEY M FRAME SUNGLASSES BLACK FRAME,Pre-Owned,$51.00,"Sold  Oct 29, 2023Sold Item",6 bids,No,No
Sunglasses Oakley Si Ballistic M Frame Alpha Mat Black Prizm TR22 OO9146-19,Brand New,$100.00,"Sold  Oct 29, 2023Sold Item",,Yes,No
AUTHENTIC OAKLEY M FRAME LANCE ARMSTRONG EDITION SUNGLASSES FRAMES ONLY USA,Pre-Owned,$117.50,"Sold  Oct 29, 2023Sold Item",25 bids,No,No
OAKLEY M FRAME SUNGLASSES BLUE FRAME BROWN LENS WITH CASE,Pre-Owned,$61.00,"Sold  Oct 29, 2023Sold Item",2 bids,No,No
Oakley M Frame Black Frame Gold Logo Brown Iridium Lens Sunglasses VTG 1990s,Pre-Owned,$75.00,"Sold  Oct 29, 2023Sold Item",1 bid,No,No
Oakley SI Ballistic M Frame 2.0 Strike Array - Clear And Grey Lenses - Hard Case,Brand New,$70.00,"Sold  Oct 29, 2023Sold Item",,Yes,No
OO9212-01 Oakley M2 Polished Black / Black Iridium M Frame,Pre-Owned,$68.00,"Sold  Oct 29, 2023Sold Item",,Yes,No
Oakley SI M Frame Ballistic 3.0 Array Clear & Prizm with Helo Kit &Case USA Made,Pre-Owned,$102.50,"Sold  Oct 29, 2023Sold Item",2 bids,No,No
Oakley M frame Gen 2 Carbon Fiber w/ Blue Iridium Strike Lenses new,New (Other),$750.00,"Sold  Oct 29, 2023Sold Item",,No,Yes
Oakley M2 Frame Sunglasses White And Black Frame * Read,Pre-Owned,$50.00,"Sold  Oct 29, 2023Sold Item",,Yes,No
Oakley M Frame Black Sport Wrap Designer Sunglassses Polarized USA AS IS,Pre-Owned,$51.00,"Sold  Oct 29, 2023Sold Item",12 bids,No,No
Vtg 80s Oakley Case 90s Vault Sunglasses High Definition Optics Heater M-Frame,Pre-Owned,$21.20,"Sold  Oct 29, 2023Sold Item",,Yes,No
OAKLEY M FRAME MUMBO GEN 1 CRYSTAL BLACK,Pre-Owned,$265.00,"Sold  Oct 28, 2023Sold Item",,Yes,No
Oakley Mumbo M Frame Cobalt Blue/Positive Red Iridium Heater Vintage w/Box,Pre-Owned,$250.00,"Sold  Oct 28, 2023Sold Item",,Yes,No
OAKLEY M FRAME SUNGLASSES BLACK FRAME (needs New Lense),Pre-Owned,$29.99,"Sold  Oct 28, 2023Sold Item",,Yes,No
NEW Oakley SI Ballistic M-Frame 2.0 Black Frame w/ Clear & Gray Lens,New (Other),$95.99,"Sold  Oct 28, 2023Sold Item",,Yes,No
Oakley SI Ballistic M Frame 3.0 Multicam w/ Grey Hybrid Lenses,Pre-Owned,$100.00,"Sold  Oct 28, 2023Sold Item",,No,Yes
Oakley M2  Sunglasses - Polished Gray Carbon Fiber Frame Polarized Lens,Pre-Owned,$99.99,"Sold  Oct 27, 2023Sold Item",,No,Yes
New WL Polarized Transition Vented Replacement Lenses for Oakley M Frame Hybrid,Brand New,$39.99,"Sold  Oct 27, 2023Sold Item",,Yes,No
[OO9146-02] Mens Oakley SI Ballistic M Frame 3.0 Sunglasses,Brand New,$119.99,"Sold  Oct 27, 2023Sold Item",,Yes,No
Vintage Oakley M Frame 2.0 Matte Black Bronze Heater Sunglasses,Pre-Owned,$63.00,"Sold  Oct 27, 2023Sold Item",15 bids,No,No
Oakley SI Ballistic 2.0 Strike Array Shield M Frame Glasses With Inserts,Pre-Owned,$54.99,"Sold  Oct 27, 2023Sold Item",,No,Yes
[11-162] Mens Oakley M-FRAME Sunglasses,Brand New,$107.99,"Sold  Oct 27, 2023Sold Item",,Yes,No
Vintage Oakley M Frame 2.0 Black Frame Black Iridium Lens Sunglasses W/case.,Pre-Owned,$58.00,"Sold  Oct 26, 2023Sold Item",19 bids,No,No
OAKLEY M2 FRAME SUNGLASSES CARBON FIBER with Extra Lenses,Pre-Owned,$76.00,"Sold  Oct 26, 2023Sold Item",3 bids,No,No
Oakley Pro M Frame Strike Sunglasses 42-377 Matte White/Slate Iridium,Brand New,$349.99,"Sold  Oct 26, 2023Sold Item",,Yes,No
Oakley Sunglasses:  M2 frame Asian Fit - Polished Black - G30 Iridium,New (Other),$80.00,"Sold  Oct 26, 2023Sold Item",,Yes,No
oakley m frame sunglasses black frame black lens,New (Other),$49.99,"Sold  Oct 26, 2023Sold Item",,Yes,No
"Oakley ""New"" M frame black rain",Pre-Owned,$175.00,"Sold  Oct 26, 2023Sold Item",1 bid,No,Yes
Oakley Ballistic M Frame 2.0 Men's Sunglasses - Clear W/ Helo kit Gasket,Pre-Owned,$50.00,"Sold  Oct 26, 2023Sold Item",1 bid,No,No
NEW OAKLEY M2 FRAME XL Polished Black PRIZM Sapphire Lens Sunglass 9343-21,Brand New,$118.88,"Sold  Oct 26, 2023Sold Item",,Yes,No
Oakley Standard Issue Ballistic M Frame 2.0 Men's Sunglasses - Black/Clear,Brand New,$65.00,"Sold  Oct 26, 2023Sold Item",1 bid,No,No
Oakley Standard Issue Ballistic M Frame 2.0 Men's Sunglasses - Black/Clear,Brand New,$73.00,"Sold  Oct 25, 2023Sold Item",5 bids,No,No
Oakley M Frame FMJ 5.56/Orange FRAME ONLY - NEAR MINT,Pre-Owned,$89.99,"Sold  Oct 25, 2023Sold Item",,Yes,No
Oakley M Frame Carbon Fiber VR28 Strike Mumbo Gen 2 Straight Stems RARE,Pre-Owned,$49.00,"Sold  Oct 25, 2023Sold Item",,Yes,No
AUTHENTIC OAKLEY M FRAME SUNGLASSES **FRAMES ONLY** USA NICE,Pre-Owned,$94.00,"Sold  Oct 25, 2023Sold Item",28 bids,No,No
Oakley SI Ballistic 2.0 Strike Array Shield M Frame Glasses - NO Lenses,Pre-Owned,$39.99,"Sold  Oct 25, 2023Sold Item",,No,Yes
Oakley 09-610 New M Frame Smoke Black Iridium Heater Lens RARE,Pre-Owned,$245.00,"Sold  Oct 25, 2023Sold Item",,Yes,No
Oakley SI Ballistic M Frame 2.0 Strike Safety Shooting Glasses Kit - 11-138,Brand New,$85.00,"Sold  Oct 25, 2023Sold Item",,Yes,No
Walleva Clear Vented Replacement Lenses For Oakley M Frame Strike Sunglasses,Brand New,$9.99,"Sold  Oct 25, 2023Sold Item",,Yes,No
Oakley M Frame Clear Strike Lens - MINT,Pre-Owned,$39.99,"Sold  Oct 25, 2023Sold Item",,Yes,No
Oakley SI M Frame 3.0 Matte Black Ballistic Sunglasses Clear Lens,Pre-Owned,$73.99,"Sold  Oct 25, 2023Sold Item",,Yes,No
Oakley SI Ballistic M Frame 2.0 (OO9213) - FRAME ONLY (No Lenses) BNIB Authentic,Brand New,$53.19,"Sold  Oct 25, 2023Sold Item",,Yes,No
Oakley M Frame 3.0 Hybrid Clear Vented Replacement Lens / SKU# OKT-100-742-002,New (Other),$65.00,"Sold  Oct 25, 2023Sold Item",,Yes,No
Early Vintage Gen 1 Oakley M Frame Mumbo Sweep Lens Pat# 4.674.851 4.867.550,Pre-Owned,$55.00,"Sold  Oct 25, 2023Sold Item",1 bid,No,Yes
Oakley - M - Frame Custom - Frame Blue - Lens Blue Iridium - NEW in BOX,Brand New,$375.00,"Sold  Oct 25, 2023Sold Item",,No,Yes
Oakley KATO Sunglasses Cavendish White Frame W/ PRIZM 24K Lens 0OO9455M 945524,Brand New,$244.99,"Sold  Oct 25, 2023Sold Item",,Yes,No
Oakley M2 Frame XL Sunglasses OO9343-05 Polished White Frame Fire Iridium Lenses,Pre-Owned,$45.00,"Sold  Oct 24, 2023Sold Item",1 bid,No,No
OAKLEY MFRAME/PRO M FRAME STRIKE CLEAR REPLACEMENT LENS NOT M2,New (Other),$50.00,"Sold  Oct 24, 2023Sold Item",,Yes,No
Oakley OEM VR28 New Hybrid M Frame Lens 07-25-01,Pre-Owned,$85.99,"Sold  Oct 24, 2023Sold Item",,No,Yes
Oakley M frame Sunglasses,Pre-Owned,$50.00,"Sold  Oct 24, 2023Sold Item",,No,Yes
"Oakley Ballistic M FrameÂ® With 3 Extra Shields, No Box Light Scuffing",Pre-Owned,$200.00,"Sold  Oct 24, 2023Sold Item",,No,Yes
Oakley M Frame VR28 Iridium Hybrid Lens - VERY NICE,Pre-Owned,$59.99,"Sold  Oct 24, 2023Sold Item",,Yes,No
Oakley KATO Sunglasses OO9455M-2449 Cavendish White Frame W/ PRIZM 24K Lens NEW,Brand New,$269.99,"Sold  Oct 24, 2023Sold Item",,Yes,No
Shop on eBay,Brand New,$20.00,,,Yes,No
Oakley OO9146 SI Ballistic M Frame Men's Rectangle Sunglasses - Black and Clear,New (Other),$60.00,"Sold  Oct 24, 2023Sold Item",,Yes,No
Oakley M2 Frame XL Sunglasses,Pre-Owned,$60.00,"Sold  Oct 24, 2023Sold Item",,Yes,No
RARE OAKLEY M2 FRAME SUNGLASSES Black Silver Frames Ruby Iridium Polarized Lens,Pre-Owned,$254.99,"Sold  Oct 24, 2023Sold Item",,Yes,No
Vintage Oakley M Frame Clear Black Mirrored Lens Sunglasses,Pre-Owned,$69.99,"Sold  Oct 24, 2023Sold Item",,No,Yes
Oakley David Duvall Signature Series Pro M Frame Black Chrome Vintage Glasses,Pre-Owned,$225.00,"Sold  Oct 24, 2023Sold Item",,No,Yes
Oakley  M Frame Sunglasses Genuine Oakley Collection-Brand New M Frame,New (Other),$140.00,"Sold  Oct 23, 2023Sold Item",,Yes,No
Standard Issue Ballistic M FrameÂ® 2.0 Strike,New (Other),$89.99,"Sold  Oct 23, 2023Sold Item",,Yes,No
NEW OAKLEY M-FRAME BLACK FRAME W/VR50 STRIKE LENS SUNGLASSES radar cycling,New (Other),$174.99,"Sold  Oct 23, 2023Sold Item",,No,Yes
Oakley SI Ballistic M Frame 3.0 9146-01 Matte Black Grey Z87.1 Shooting Glasses,Brand New,$114.00,"Sold  Oct 23, 2023Sold Item",,No,Yes
Oakley SI Ballistic M Frame Glasses And Case Complete,New (Other),$50.00,"Sold  Oct 23, 2023Sold Item",,Yes,No
Oakley M Frame Clear Sweep Lens - MINT,Pre-Owned,$39.99,"Sold  Oct 23, 2023Sold Item",,Yes,No
Oakley SI M Frame 2.0 Shooting Glasses Sunglasses & Clear Lens Case Bag Papers,Pre-Owned,$75.00,"Sold  Oct 23, 2023Sold Item",7 bids,No,No
New Oakley OO9213-03 Si M Frame 2.0 Men's Sunglasses Matte Black Grey Lenses,Brand New,$96.99,"Sold  Oct 23, 2023Sold Item",,Yes,No
Oakley Sunglasses Frame:  M2 frame - Polished White,New (Other),$69.99,"Sold  Oct 23, 2023Sold Item",,Yes,No
New Walleva Ice Blue Replacement Lenses For Oakley M Frame Strike,Brand New,$16.99,"Sold  Oct 22, 2023Sold Item",,Yes,No
Oakley M Frame Black Iridium Hybrid S Lens - MINT,Pre-Owned,$79.99,"Sold  Oct 22, 2023Sold Item",,Yes,No
GalaxPy Nose ads Rubber Kits For Oakley M Frame Sweep/Strike/Hybrid/Heater Black,New (Other),$5.95,"Sold  Oct 22, 2023Sold Item",,Yes,No
New WL Polarized Fire Red Vented Replacement Lenses for Oakley M Frame Sweep,Brand New,$17.99,"Sold  Oct 22, 2023Sold Item",,Yes,No
Oakley SI Ballistic M Frame 2.0 Strike Safety Shooting Sunglasses 90s Y2K Vtg,Pre-Owned,$99.99,"Sold  Oct 22, 2023Sold Item",,No,Yes
Made in USA! Custom Oakley SI M Frame 2.0 Z87+ Sunglasses 70/18 134 /KAD302,Pre-Owned,$59.95,"Sold  Oct 22, 2023Sold Item",,No,Yes
Oakley M Frame Frames,New (Other),$109.50,"Sold  Oct 22, 2023Sold Item",17 bids,No,No
Oakley SI Ballistic M-frame 3.0 Sunglasses MIR Z87 Military Black Shades Mens *,Pre-Owned,$45.00,"Sold  Oct 22, 2023Sold Item",1 bid,No,No
Oakley Sunglasses:  M2 frame Asian Fit - Polished Navy - Black Iridium Polarized,New (Other),$85.00,"Sold  Oct 22, 2023Sold Item",,Yes,No
Galaxy Replacement Clip Rubber Kits For Oakley Industrial M Frame 2.0 Black,New (Other),$7.97,"Sold  Oct 22, 2023Sold Item",,Yes,No
Oakley M Frames Gloss Black/Silver Strike Lense Black + Heater Brown Hard Case,Pre-Owned,$69.00,"Sold  Oct 22, 2023Sold Item",2 bids,No,No
Oakley M Frame Clear Shield Men's Sunglasses OO9060 11-161 29 OO9060 11-161 29,Brand New,$98.99,"Sold  Oct 22, 2023Sold Item",,Yes,No
"Oakley Ballistic M FrameÂ® With 3 Extra Shields, No Box Light Scuffing",Pre-Owned,$200.00,"Sold  Oct 22, 2023Sold Item",,No,Yes
Oakley SI Ballistic M Frame 3.0 Safety Shooting Glasses Kit W/ Hardcover Case,Brand New,$199.00,"Sold  Oct 22, 2023Sold Item",,Yes,No
Oakley M Frame HI VIS Yellow Vented Hybrid S Lens - NEAR MINT,Pre-Owned,$49.99,"Sold  Oct 22, 2023Sold Item",,No,Yes
New In Box OAKLEY MFRAME/PRO M FRAME STRIKE CLEAR REPLACEMENT LENS NOT M2,Brand New,$25.00,"Sold  Oct 22, 2023Sold Item",,Yes,No
Oakley M Frame Gray Wrap Sunglasses Made in USA Black Lenses,Pre-Owned,$71.99,"Sold  Oct 21, 2023Sold Item",,No,Yes
Menâ€™s Oakley M Frame Sunglasses Black with 5 Lenses and Case,Pre-Owned,$45.00,"Sold  Oct 21, 2023Sold Item",,Yes,No
New/Unworn! Vintage Oakley M-Frame FMJ Full Metal Jacket Red Gen 3 Sunglasses,Pre-Owned,$539.95,"Sold  Oct 21, 2023Sold Item",,Yes,No
Oakley M-Frame Green Sunglasses,Pre-Owned,$50.00,"Sold  Oct 21, 2023Sold Item",24 bids,No,No
Oakley Minute Made In USA,Pre-Owned,$60.00,"Sold  Oct 21, 2023Sold Item",,Yes,No
Oakley Sport Sunglasses,Pre-Owned,$35.00,"Sold  Oct 21, 2023Sold Item",11 bids,No,No
Oakley Mumbo M Frame Gen 1 Persimmon Heater - LENS ONLY,Pre-Owned,$29.99,"Sold  Oct 21, 2023Sold Item",,Yes,No
OAKLEY M2 SKY BLUE FINGERPRINT FRAME W Black IRIDIUM LENS SUNGLASSES,Pre-Owned,$90.00,"Sold  Oct 21, 2023Sold Item",,Yes,No
OAKLEY MFRAME/PRO M FRAME SWEEP NON VENTED +RED IRIDIUM REPLACEMENT LENS NOT M2,New (Other),$170.00,"Sold  Oct 9, 2023Sold Item",,Yes,No
Oakley SI Ballistic M Frame 2.0 Strike Array Matte Frame Clear and Grey Lenses,New (Other),$72.99,"Sold  Oct 20, 2023Sold Item",,Yes,No
Oakley Sunglasses 0OO9343 M2 Frame XL Polished White Fire Iridium,Brand New,$90.00,"Sold  Oct 20, 2023Sold Item",,Yes,No
Oakley M Frame Blue Sunglasses (Needs new lenses) Worn Cushion Pads,Pre-Owned,$54.95,"Sold  Oct 20, 2023Sold Item",,No,Yes
Oakley SI Ballistic 2.0 Strike Array Shield M Frame Glasses With Inserts,Pre-Owned,$54.99,"Sold  Oct 20, 2023Sold Item",,No,Yes
Oakley M Frame Jet Black Sunglasses - Slate Iridium Vented Sweep - VERY NICE,Pre-Owned,$129.99,"Sold  Oct 20, 2023Sold Item",,Yes,No
Oakley M Frame Rootbeer Brown Gold Iridium Polarized Strike 09-232 RARE,Pre-Owned,$349.99,"Sold  Oct 20, 2023Sold Item",,Yes,No
Oakley M Frame Black Iridium Sweep Replacemen Lens OEM 2006 Excellent Condition,Pre-Owned,$39.99,"Sold  Oct 19, 2023Sold Item",,Yes,No
Galaxy Nose Pads Rubber Kits For Oakley M Frame Hybrid/Heater/Sweep/Strike Black,New (Other),$5.95,"Sold  Oct 19, 2023Sold Item",,Yes,No
Oakley M Frame Sunglasses Brown Frames Purple Lenses Sport Changeable Lenses,Pre-Owned,$72.88,"Sold  Oct 19, 2023Sold Item",,Yes,No
Galaxy Lenses+Nose Pads+Earsocks For Oakley M Frame 2.0 Strike Industrial Black,New (Other),$14.38,"Sold  Oct 19, 2023Sold Item",,Yes,No
Oakley SI Ballistic M Frame 2.0 Strike Shield Glasses,Brand New,$78.00,"Sold  Oct 19, 2023Sold Item",7 bids,No,No
Vintage Oakley M Frame 2.0 Matte Black Bronze Persimmon & Rose Lenses,Pre-Owned,$102.50,"Sold  Oct 19, 2023Sold Item",17 bids,No,No
Oakley OO9343 M2 Plastic Frame XL Men Sunglasses With Extra Grey Sock Kit,New (Other),$80.00,"Sold  Oct 19, 2023Sold Item",,No,Yes
OAKLEY M-FRAME METALLIC RED FRAME/ W CLEAR LENSES,Pre-Owned,$150.00,"Sold  Oct 19, 2023Sold Item",,Yes,No
Oakley OO9146 SI Ballistic M Frame Men's Rectangle Sunglasses - Black and Clear,Brand New,$79.99,"Sold  Oct 19, 2023Sold Item",,Yes,No
Oakley Standard Issue Ballistic M Frame 2.0 Men's Sunglasses - Black/Clear,Brand New,$83.00,"Sold  Oct 18, 2023Sold Item",9 bids,No,No
Oakley M Frame Z87 Sunglasses Clear & Black Shield Lenses w/ Case,Pre-Owned,$50.00,"Sold  Oct 18, 2023Sold Item",,No,Yes
OAKLEY M FRAME GRAY/CHROME LENS GLASSES - Rough Shape,Pre-Owned,$29.99,"Sold  Oct 18, 2023Sold Item",,No,Yes
Oakley M Frame Grey Sweep Lens - MINT - BOXED,Pre-Owned,$69.99,"Sold  Oct 18, 2023Sold Item",,Yes,No
Oakley M Frames Gloss Black/Silver Strike Sunglasses W/Dust Bag~Polarized,Pre-Owned,$58.00,"Sold  Oct 17, 2023Sold Item",2 bids,No,No
Oakley M Frame Gen 2 Mumbo Gold Mine w/ Gold Iridium Sunglasses Rare razor blade,Pre-Owned,$179.00,"Sold  Oct 17, 2023Sold Item",,No,Yes
Shop on eBay,Brand New,$20.00,,,Yes,No
Oakley SI Ballistic M Frame 2.0 Strike Array Frame Black Lense Clear Grey 11-138,Brand New,$89.99,"Sold  Oct 17, 2023Sold Item",,Yes,No
Oakley SI Ballistic M Frame Strike 2.0Â OO9046,Pre-Owned,$43.00,"Sold  Oct 17, 2023Sold Item",17 bids,No,No
Oakley SI Ballistic M Frame Strike 2.0Â OO9046,Pre-Owned,$64.00,"Sold  Oct 17, 2023Sold Item",31 bids,No,No
Oakley OO9146-02 Ballistic M Frame 3.0 Strike Men's Sunglasses,New (Other),$80.00,"Sold  Oct 17, 2023Sold Item",,No,Yes
Oakley Sunglasses OO9060 11-161 M Frame Strike Black Frame Clear Lenses,Brand New,$94.99,"Sold  Oct 17, 2023Sold Item",,Yes,No
Oakley M Frame Pro Polished Aluminum - Frame Only - NEAR MINT,Pre-Owned,$129.99,"Sold  Oct 17, 2023Sold Item",,No,Yes
New Oakley SI M FRAME 2.0 Sunglasses | 9213-03 Matte Black /ANSI Z87.1 Grey Lens,Brand New,$112.45,"Sold  Oct 14, 2023Sold Item",,Yes,No
Galaxy Earsock Rubber Kits For Oakley Si Ballistic M Frame 2.0 Z87 Black,New (Other),$5.95,"Sold  Oct 17, 2023Sold Item",,Yes,No
Oakley SI Alpha M-Frame Glasses With EXTRA lenses and Goggles.,Pre-Owned,$299.00,"Sold  Oct 17, 2023Sold Item",,Yes,No
Oakley Men's M Frame 2.0 Hybrid Array Glasses - Matte Black/Clear,Pre-Owned,$20.00,"Sold  Oct 16, 2023Sold Item",1 bid,No,Yes
Oakley M2 FRAME Sunglasses Silver/Fire Iridium  OO9212-04 121 (Case Included),Pre-Owned,$63.24,"Sold  Oct 16, 2023Sold Item",,No,Yes
Oakley M Frame Glasses,Pre-Owned,$80.00,"Sold  Oct 16, 2023Sold Item",,No,Yes
Oakley M2 Frame 009343-2045 Men's Black Frame Polarized Prizm Lens Sunglasses,Pre-Owned,$47.00,"Sold  Oct 16, 2023Sold Item",4 bids,No,No
Oakley Sunglasses Frame:  M2 frame - Polished White,New (Other),$69.99,"Sold  Oct 16, 2023Sold Item",,Yes,No
"Oakley HSTN M Sunglasses, matte carbon Frame, PRIZM Tungsten Lens",Brand New,$126.49,"Sold  Oct 16, 2023Sold Item",,Yes,No
New Oakley EVZero Path Polished Black / Blk Iridium Asian Fit Sunglasses m Frame,New (Other),$109.00,"Sold  Oct 16, 2023Sold Item",,Yes,No
Wholesale POLARIZED Replacement Lenses for M Frame Strike Vented-Fire Red Color,Brand New,$6.95,"Sold  Oct 16, 2023Sold Item",,Yes,No
Oakley SI Ballistic M Frame 3.0 Dark Bone (FDE) w/Clear Lens OO9146-07,Pre-Owned,$60.00,"Sold  Oct 16, 2023Sold Item",1 bid,No,No
oakley m frame sunglasses with case,Pre-Owned,$250.00,"Sold  Oct 16, 2023Sold Item",,No,Yes
NEW Oakley SI Ballistic M Frame 2.0 Replacement Lens Strike Clear 11-112,Brand New,$30.00,"Sold  Oct 16, 2023Sold Item",,Yes,No
Oakley SI Ballistic M Frame 2.0 Strike Array Frame Black Lense Clear Grey 11-138,Brand New,$89.99,"Sold  Oct 16, 2023Sold Item",,Yes,No
Oakley M Frame VR28 Iridium Sweep Lens - NICE,Pre-Owned,$39.99,"Sold  Oct 15, 2023Sold Item",,Yes,No
Oakley SI M Frame 2.0 Shooting Glasses Sunglasses & Clear Lens Case Bag Papers,Pre-Owned,$64.99,"Sold  Oct 15, 2023Sold Item",,Yes,No
oakley m2 sunglasses Blue White Frames With Box,Pre-Owned,$35.00,"Sold  Oct 15, 2023Sold Item",,Yes,No
Oakley SI Ballistic M Frame 2.0,New (Other),$75.00,"Sold  Oct 15, 2023Sold Item",,Yes,No
Oakley M2 Frame XL Sunglasses OO9343-05 Polished White Frame Fire Iridium Lenses,Pre-Owned,$47.99,"Sold  Oct 15, 2023Sold Item",,Yes,No
Vintage 90's Oakley M Frame Sunglasses,Pre-Owned,$150.00,"Sold  Oct 15, 2023Sold Item",,No,Yes
Oakley Pro M Frame Sunglasses Disc. No Hinge Red Iridium Strike Lens w/extras,Pre-Owned,$192.50,"Sold  Oct 15, 2023Sold Item",5 bids,No,No
Oakley Case Hard Shell M-Frame Foam Insert Full Zipper Good Condition,Pre-Owned,$15.00,"Sold  Oct 15, 2023Sold Item",,No,Yes
Oakley SI Ballistic M Frame 2.0 Strike Safety Shooting Glasses Kit - 11-138,Brand New,$85.00,"Sold  Oct 15, 2023Sold Item",,Yes,No
Vintage Oakley M Frame 2.0 Green Frame Black Iridium Lens Sunglasses,Pre-Owned,$69.00,"Sold  Oct 15, 2023Sold Item",14 bids,No,No
Vintage Oakley M Frame 2.0 Matte Black  Sunglasses As Is Parts,Pre-Owned,$20.50,"Sold  Oct 15, 2023Sold Item",7 bids,No,No
Vintage Oakley M Frame 2.0 Matte Black Bronze Heater Sunglasses,Pre-Owned,$59.00,"Sold  Oct 15, 2023Sold Item",27 bids,No,No
Oakley SI M Frame 2.0 Shooting Glasses Sunglasses & Clear Lens Case BROKEN CLIP,Pre-Owned,$54.99,"Sold  Oct 15, 2023Sold Item",,No,Yes
Menâ€™s Oakley M Frame Sunglasses Black,Pre-Owned,$45.00,"Sold  Oct 15, 2023Sold Item",,Yes,No
Oakley M Frame Pro Matte Black - Grey Sweep - MINT NEW IN BOX,Pre-Owned,$229.99,"Sold  Oct 15, 2023Sold Item",,No,Yes
Oakley Pro M Frame Polished Blue/Gold Icons w/ Gold Hybrid/Gold Strike Lenses,New (Other),$199.00,"Sold  Oct 15, 2023Sold Item",,Yes,No
OAKLEY SI M-FRAME REPL LENS | HYBRID S VR28 11-360 | GENUINE / OEM,New (Other),$125.38,"Sold  Sep 17, 2023Sold Item",,Yes,No
Oakley SI Ballistic M Frame 3.0 Multicam w/ Clear Hybrid Lenses,Pre-Owned,$90.00,"Sold  Oct 15, 2023Sold Item",,Yes,No
"Oakley M Frame Mumbo ""The Bridge"" Shadow Camo Prizm Ruby/Jade Heater - NEW",Brand New,$249.99,"Sold  Oct 15, 2023Sold Item",,Yes,No
WL Polarized Transition Vented Lenses + Black Nosepads for Oakley M Frame Strike,Brand New,$39.99,"Sold  Oct 15, 2023Sold Item",,Yes,No
Sunglasses Kits for-Oakley PRO M Frame Earsocks Nose Pad Pieces Rubber Ear Socks,Brand New,$22.45,"Sold  Oct 14, 2023Sold Item",,Yes,No
Oakley Safety Glasses Case Only **No Glasses** Z87 M Frame 2.0 Black Shooting,Pre-Owned,$9.99,"Sold  Oct 14, 2023Sold Item",,Yes,No
Galaxy Replacement Lenses For Oakley Si Ballistic M Frame 2.0 Z87 Blue/Grey/Red,New (Other),$20.98,"Sold  Oct 14, 2023Sold Item",,Yes,No
Oakley M2 Frame XL Prizm Black Polarized Sport Men's Sunglasses OO9343 934319 45,Brand New,$133.55,"Sold  Oct 13, 2023Sold Item",,Yes,No
VINTAGE OAKLEY M FRAME SUNGLASSES MADE IN USA Dark/clear lenses,Pre-Owned,$70.00,"Sold  Oct 14, 2023Sold Item",,Yes,No
NEW OAKLEY SI Ballistic Sun Glasses M Frame 2.0 Array Strike Clear & Gray,New (Other),$40.00,"Sold  Oct 13, 2023Sold Item",,Yes,No
Oakley New KATO Sunglasses OO9455M-0249 Polished Black Frame W/ PRIZM 24K Lens,Brand New,$199.95,"Sold  Oct 13, 2023Sold Item",,No,Yes
RARE COLOR Oakley M Frames Pro Polished Aluminum/G30 Iridium Strike,Pre-Owned,$164.66,"Sold  Oct 13, 2023Sold Item",,No,Yes
Oakley Ballistic M FrameÂ® Alpha Array,Pre-Owned,$199.99,"Sold  Oct 13, 2023Sold Item",,Yes,No
NEW Oakley HSTN M Sunglasses Matte Carbon Frame PRIZM Tungsten Lens,Brand New,$139.99,"Sold  Oct 13, 2023Sold Item",1 bid,No,No
Oakley SI Ballistic M Frame 2.0 Strike Array Frame Black Lense Clear Grey,Brand New,$51.00,"Sold  Oct 13, 2023Sold Item",2 bids,No,No
Oakley SI Ballistic M Frame 2.0 Strike Array Frame Black Lense Clear Grey 11-138,Brand New,$73.00,"Sold  Oct 13, 2023Sold Item",13 bids,No,No
Oakley M2 FRAME XL polished black PRIZM sapphire OO9343-21 sunglasses NEW IN BOX,Brand New,$109.99,"Sold  Oct 12, 2023Sold Item",,Yes,No
"Oakley M Frame Sunglasses With Case, Interchangeable Lenses and Nose Peices!",Pre-Owned,$219.99,"Sold  Oct 12, 2023Sold Item",,Yes,No
Oakley Pro M Frame Array Ballistic Hard Storage Case Black 07-004 RARE,Pre-Owned,$79.99,"Sold  Oct 12, 2023Sold Item",,Yes,No
Oakley M2 Frame XL Black Iridium Polarized Replacement Lens Authentic,New (Other),$79.99,"Sold  Oct 12, 2023Sold Item",,Yes,No
"Oakley Standard Issue Ballistic M Frame 2.0 Hybrid Replacement Lens, VR28, NOS",New (Other),$19.99,"Sold  Oct 12, 2023Sold Item",,Yes,No
Oakley M Frame Pro Polished Aluminum - Positive Red Iridium Sweep - NEAR MINT,Pre-Owned,$249.99,"Sold  Oct 12, 2023Sold Item",,No,Yes
New WL Polarized Transition/Photochromic Lenses For Oakley New M Frame Sweep,Brand New,$24.99,"Sold  Oct 11, 2023Sold Item",,Yes,No
Shop on eBay,Brand New,$20.00,,,Yes,No
Oakley Men's M Frame 2.0 Hybrid Array Glasses - Matte Black/Clear,Pre-Owned,$1.00,"Sold  Oct 11, 2023Sold Item",,Yes,No
Galaxy Nose Pads Rubber Kits For Oakley M2 Frame XL Sunglasses White Color,New (Other),$4.46,"Sold  Oct 11, 2023Sold Item",,Yes,No
OAKLEY SUNGLASSES M FRAME CARBON FIBER GOLF SWEEP VENTED LENS POLARIZED VINTAGE,Pre-Owned,$147.50,"Sold  Oct 11, 2023Sold Item",2 bids,No,No
OAKLEY SUNGLASSES M FRAME CARBON FIBER GOLF SWEEP VENTED LENS VINTAGE,Pre-Owned,$142.50,"Sold  Oct 11, 2023Sold Item",2 bids,No,No
Oakley  Oo9343 M2 Frame XL Shield Men's Sunglasses,Pre-Owned,$27.00,"Sold  Oct 11, 2023Sold Item",1 bid,No,Yes
Nosepads Matte Clear Grey Oakley M Frames 1.0/2.0 Replacement Mumbo,Pre-Owned,$12.99,"Sold  Oct 10, 2023Sold Item",,Yes,No
Vtg 80s Oakley Case 90s Vault Sunglasses High Definition Optics Heater M-Frame,Pre-Owned,$25.00,"Sold  Oct 10, 2023Sold Item",,No,Yes
Oakley SI Ballistic M Frame Alpha Sunglasses/Lenses/Goggles/Case Black New,New (Other),$325.00,"Sold  Oct 10, 2023Sold Item",,Yes,No
New Oakley Nose Piece Nose Pad For SI M Frame 3.0 OO9146 OEM Black,Brand New,$27.00,"Sold  Oct 10, 2023Sold Item",,Yes,No
Oakley SI Ballistic M Frame 2.0 Strike Array Clear Lenses,New (Other),$53.99,"Sold  Oct 10, 2023Sold Item",,No,Yes
Oakley Sunglasses Frame:  M2 frame - Polished Navy,New (Other),$69.99,"Sold  Oct 10, 2023Sold Item",,Yes,No
Oakley Ballistic M Frame 2.0 Men's Sunglasses - Clear W/ Helo kit Gasket,Pre-Owned,$46.00,"Sold  Oct 10, 2023Sold Item",4 bids,No,No
[OO9343-01] Mens Oakley M2 Frame XL Sunglasses,Brand New,$88.99,"Sold  Oct 10, 2023Sold Item",,Yes,No
Oakley M Frame Matte Black Sunglasses - G30 Iridium Vented Heater - NEAR MINT,Pre-Owned,$149.99,"Sold  Oct 9, 2023Sold Item",,No,Yes
Oakley Sunglasses Frame:  M2 frame - Infrared,New (Other),$69.99,"Sold  Oct 9, 2023Sold Item",,Yes,No
Oakley EV Zero Stride Prizm Low Light Lens - MINT,Pre-Owned,$44.99,"Sold  Oct 9, 2023Sold Item",,Yes,No
Oakley SI Ballistic M Frame 2.0 Strike Array - Clear And Grey Lenses - Hard Case,Brand New,$70.00,"Sold  Oct 9, 2023Sold Item",,No,Yes
Oakley Sunglasses M2 Frame Matte Black Prizm Black Polarized W/ Case,Pre-Owned,$67.50,"Sold  Oct 9, 2023Sold Item",,Yes,No
Oakley M Frame Matte Black Grey Hybrid S Silver Icons 09-130 RARE,Pre-Owned,$159.99,"Sold  Oct 9, 2023Sold Item",,Yes,No
Oakley M2 Frame XL Prizm Black Polarized Replacement Lens Authentic 101-648-011,New (Other),$79.99,"Sold  Oct 9, 2023Sold Item",,Yes,No
OAKLEY M-FRAME SLASH VINTAGE RETRO M FRAME SUNGLASSES OAKLEY SHOOTING SPORTS NR,Pre-Owned,$132.50,"Sold  Oct 9, 2023Sold Item",14 bids,No,No
