title,condition,price,sold_date,num_bids,buy_it_now,best_offer
Oakley M Frame Blue Iridium Hybrid S Lens - MINT,Pre-Owned,$99.99,"Sold  Oct 9, 2023Sold Item",,Yes,No
Oakley M Frame Matte Black Grey Hybrid S Silver Icons 09-130 RARE,Pre-Owned,$159.99,"Sold  Oct 9, 2023Sold Item",,Yes,No
Made in USA! Custom Oakley SI M Frame 2.0 Z87+ Sunglasses 70/18 134 /KAD302,Pre-Owned,$69.99,"Sold  Oct 8, 2023Sold Item",,Yes,No
Oakley M Frame Livestrong Sunglasses - Black Iridium Hybrid S - MINT,Pre-Owned,$179.99,"Sold  Oct 8, 2023Sold Item",,No,Yes
Oakley M Frame Sunglasses 1996 Original Authentic with Case,Pre-Owned,$107.50,"Sold  Oct 8, 2023Sold Item",10 bids,No,No
Galaxy Earsocks Rubber Kits For Oakley M Frame Heater/Sweep/Strike/Hybrid Black,New (Other),$3.55,"Sold  Oct 8, 2023Sold Item",,Yes,No
Oakley M2 Frame Polarized Sunglasses OO9212-06 Polished Black/OO Red Iridium,Pre-Owned,$74.99,"Sold  Oct 8, 2023Sold Item",,Yes,No
Oakley M Frame Positive Red Iridium Hybrid S Lens - NEAR MINT,Pre-Owned,$79.99,"Sold  Oct 8, 2023Sold Item",,No,Yes
Oakley M Frame Clear Sweep Lens - MINT,Pre-Owned,$49.99,"Sold  Oct 8, 2023Sold Item",,No,Yes
Vintage Square Oakley M Frame CASE + 3  Lenses Strike lense Lot NO SUNGLASSES,Pre-Owned,$67.00,"Sold  Oct 8, 2023Sold Item",5 bids,No,No
Oakley M Frame Black Sport Wrap Designer Sunglassses Polarized USA AS IS,Pre-Owned,$49.00,"Sold  Oct 8, 2023Sold Item",10 bids,No,No
Oakley M Frame Gen 2 Matte Black FRAME ONLY - NEAR MINT,Pre-Owned,$99.99,"Sold  Oct 8, 2023Sold Item",,No,Yes
Oakley M2 Frame XL OO9343 Matte Black with Prizm Black Polarized Lens Wrap Men's,Brand New,$109.99,"Sold  Oct 8, 2023Sold Item",,Yes,No
New Oakley EVZero Stride Steel w/ Sapphire Iridium Sunglasses Rare M frame radar,New (Other),$139.00,"Sold  Oct 8, 2023Sold Item",,Yes,No
Oakley M Frame Black Sport Wrap Designer Sunglassses Polarized USA AS IS,Pre-Owned,$60.00,"Sold  Oct 8, 2023Sold Item",,Yes,No
oakley sunglasses men used C-005 polarized,Pre-Owned,$45.99,"Sold  Oct 8, 2023Sold Item",,Yes,No
Oakley Pro M Frame Sunglasses Disc. No Hinge Red Iridium Strike Lens w/extras,Pre-Owned,$180.00,"Sold  Oct 8, 2023Sold Item",1 bid,No,No
OAKLEY M FRAME HINGLESS USED,Pre-Owned,$50.00,"Sold  Oct 7, 2023Sold Item",,Yes,No
[OO9343-05] Mens Oakley M2 Frame XL Sunglasses,Brand New,$111.99,"Sold  Oct 7, 2023Sold Item",,Yes,No
Oakley Men's M Frame 2.0 Hybrid Array Glasses - Matte Black/Clear,Pre-Owned,$48.00,"Sold  Oct 6, 2023Sold Item",12 bids,No,No
OAKLEY M2 FRAME XL CUSTOM POLISHED WHITE PRIZM SAPPHIRE POLARIZED SUNGLASSES NEW,Brand New,$160.00,"Sold  Oct 6, 2023Sold Item",,Yes,No
OAKLEY  M-FRAME PRO M-FRAME SLATE EAR SOCK / NOSE  PIECE KIT NEW IN BOX RARE,Brand New,$50.00,"Sold  Oct 6, 2023Sold Item",,Yes,No
Oakley Sunglasses M Frame Heater Lenses Vintage 1990s,Pre-Owned,$167.50,"Sold  Oct 6, 2023Sold Item",18 bids,No,No
Pre-Owned - M Frame Pro Oakley LARGE Microfiber BAG/POUCH Sunglasses,Pre-Owned,$32.99,"Sold  Oct 6, 2023Sold Item",,Yes,No
Oakley M Frame Sunglasses Made In USA Some Wear On Ear Pads,Pre-Owned,$85.00,"Sold  Oct 6, 2023Sold Item",,Yes,No
oakley m-2 frame polarized sunglasses,Pre-Owned,$60.00,"Sold  Oct 6, 2023Sold Item",1 bid,No,No
Oakley M Frame Black Sport Wrap Designer Sunglassses Polarized USA,Pre-Owned,$102.50,"Sold  Oct 6, 2023Sold Item",14 bids,No,No
Galaxy Nose Pads Rubber Kits For Oakley M2 Frame Sunglasses Black/Blue/Red,New (Other),$10.98,"Sold  Oct 6, 2023Sold Item",,Yes,No
âœ…ðŸ•¶ï¸ OAKLEY SI BALLISTIC M FRAME 3.0 009146 DARK BONE/GREY ANSI Z87.1 SUNGLASSES,Brand New,$165.00,"Sold  Oct 6, 2023Sold Item",,Yes,No
Oakley Large Microfiber Bag/Pouch Case M Frame Pro Sunglasses,Pre-Owned,$29.99,"Sold  Oct 6, 2023Sold Item",,Yes,No
Oakley SI Ballistic M Frame 3.0 Multicam w/Grey Lens 009146-02,New (Other),$80.00,"Sold  Oct 5, 2023Sold Item",1 bid,No,No
Oakley Mframe,Pre-Owned,$132.50,"Sold  Oct 5, 2023Sold Item",3 bids,No,No
Oakley Mframe,Pre-Owned,$81.00,"Sold  Oct 5, 2023Sold Item",3 bids,No,No
Oakley M2 Frame Polarized Sunglasses OO9212-19 Polished White/Jade Iridium,Brand New,$139.99,"Sold  Oct 5, 2023Sold Item",,Yes,No
New WL Polarized 24K Gold Vented Replacement Lenses For Oakley M Frame Strike,Brand New,$29.99,"Sold  Oct 5, 2023Sold Item",,Yes,No
Galaxy Replacement Lenses For Oakley M Frame Strike Black Polarized 100% UVAB,New (Other),$6.88,"Sold  Oct 5, 2023Sold Item",,Yes,No
Oakley Mumbo M Frame Black Sunglasses Missing Nose Piece Lightly Scratched Lens,Pre-Owned,$75.00,"Sold  Oct 4, 2023Sold Item",,No,Yes
oakley M Frame rootbeer Sweep w grey lenses NEW,Brand New,$300.00,"Sold  Oct 4, 2023Sold Item",,No,Yes
OAKLEY SUNGLASSES M FRAME GEN - 2 SWEEP  RUBY LENS CUSTOM SPLATTER VINTAGE,Pre-Owned,$37.00,"Sold  Oct 4, 2023Sold Item",3 bids,No,No
Shop on eBay,Brand New,$20.00,,,Yes,No
OAKLEY SUNGLASSES M FRAME GEN - 2 SWEEP  RUBY LENS CUSTOM SPLATTER VINTAGE,Pre-Owned,$37.00,"Sold  Oct 4, 2023Sold Item",3 bids,No,No
Oakley M2 OO9343-09 Polished Black XL Frame Black Iridium Polarized Lens...,Pre-Owned,$80.00,"Sold  Oct 4, 2023Sold Item",,No,Yes
Oakley M2 Frame XL Prizm ROAD Lens - Brand New / Lens Only,New (Other),$79.95,"Sold  Oct 4, 2023Sold Item",,Yes,No
Galaxy Nose Pads Rubber Kits For Oakley M2 Frame Sunglasses Black/White,New (Other),$7.98,"Sold  Oct 4, 2023Sold Item",,Yes,No
"Oakley OO9455M-1849 Kato Prizm Road Black Lenses, Grey Smoke Frame Sunglasses",Pre-Owned,$53.00,"Sold  Oct 4, 2023Sold Item",4 bids,No,No
NEW USMC OAKLEY SI Ballistic Sun Glasses M Frame 2.0 Array Strike Clear & Gray,New (Other),$74.99,"Sold  Oct 3, 2023Sold Item",,No,Yes
OAKLEY M Frame Sweep Strap 1.0 2.0 3.0 Strike M2 Hybrid.,Brand New,$89.99,"Sold  Oct 3, 2023Sold Item",,Yes,No
Oakley M2 FRAME Polished Black Navy / ICE Iridium Sunglasses radar flak jacket m,New (Other),$99.00,"Sold  Oct 3, 2023Sold Item",,Yes,No
Oakley Sunglasses:  M2 frame Asian Fit - Polished Black - Grey,New (Other),$80.00,"Sold  Oct 3, 2023Sold Item",,Yes,No
Oakley SI Ballistic Tan M Frame with Grey Prizm and Clear Lenses OO9296-1944,Brand New,$150.00,"Sold  Oct 3, 2023Sold Item",,No,Yes
READ! Oakley M2 Polished Black Frames Only!,Pre-Owned,$49.99,"Sold  Oct 3, 2023Sold Item",,Yes,No
Oakley Kato Hunter Green Frame Prizm Black Lens 9455M 1949 Sunglasses 136 Mens,Brand New,$179.99,"Sold  Oct 3, 2023Sold Item",,Yes,No
Oakley M Frame Black Sport Wrap Designer Sunglassses,Pre-Owned,$65.00,"Sold  Oct 3, 2023Sold Item",,No,Yes
Oakley Mercenary Matte Black Sunglasses - Prizm Black - NICE,Pre-Owned,$59.99,"Sold  Oct 3, 2023Sold Item",,Yes,No
Oakley M2 Frame XL Prizm Road Sport Men's Sunglasses - Includes Gift Receipt,Brand New,$113.40,"Sold  Oct 3, 2023Sold Item",,Yes,No
Oakley M Frame Pro Sunglasses Vented Heater Silver Black,Pre-Owned,$199.99,"Sold  Oct 3, 2023Sold Item",,No,Yes
Oakley M2 Frame Men's Wrap Sunglasses - OO9212-01,Brand New,$60.00,"Sold  Oct 2, 2023Sold Item",1 bid,No,No
Oakley Safety Glasses Frame W/Case **NO LENS** Z87 M Frame 2.0 Black Shooting,Pre-Owned,$17.00,"Sold  Oct 2, 2023Sold Item",,Yes,No
Oakley M Frame Polished Black Sunglasses With Case,Pre-Owned,$76.50,"Sold  Oct 2, 2023Sold Item",,Yes,No
Oakley M-Frame Sunglasses - Chrome With Vented Gradient gray lens,Pre-Owned,$102.50,"Sold  Oct 2, 2023Sold Item",29 bids,No,No
Oakley Men's SI M 2.0 Sunglasses Frame - Z87 012808 & 012908 Lenses,Pre-Owned,$46.00,"Sold  Oct 2, 2023Sold Item",17 bids,No,No
Oakley M2 Frame XL Polished Black Replacement Frame Only Authentic OO9343,New (Other),$74.99,"Sold  Oct 2, 2023Sold Item",,Yes,No
Oakley M2 FRAME XL polished black/grey OO9343-01 sunglasses NEW IN BOX!,Brand New,$89.99,"Sold  Oct 2, 2023Sold Item",,Yes,No
Oakley SI Ballistic M Frame 3.0 Matte Black Z87 Clear & Gray Lenses 0OO9146 NIB,Brand New,$105.00,"Sold  Oct 2, 2023Sold Item",,Yes,No
Oakley Matte Black Si M Frame Ballistic Alpha Clear Lens 09296-10,Pre-Owned,$80.99,"Sold  Oct 2, 2023Sold Item",,Yes,No
Oakley S.I. M Frame Sunglasses,New (Other),$85.00,"Sold  Oct 1, 2023Sold Item",,Yes,No
Oakley M Frame Black Frames Only,Pre-Owned,$45.00,"Sold  Oct 1, 2023Sold Item",,No,Yes
Galaxy Replacement Lens For Oakley M2 Frame XL Vented Sunglasses Photochromic,New (Other),$9.98,"Sold  Oct 1, 2023Sold Item",,Yes,No
Oakley M Frame Sunglasses Used.,Pre-Owned,$41.00,"Sold  Oct 1, 2023Sold Item",8 bids,No,No
Oakley M2 FRAME XL polished black/grey OO9343-01 sunglasses NEW IN BOX!,Brand New,$84.99,"Sold  Oct 1, 2023Sold Item",,Yes,No
Mens Oakley M2 Frame XL Sunglasses,New (Other),$69.00,"Sold  Oct 1, 2023Sold Item",6 bids,No,No
"OAKLEY M-Frame Sunglasses W/Amber Colored Lenses, Made in USA, Excellent",Pre-Owned,$94.00,"Sold  Oct 1, 2023Sold Item",,No,Yes
Oakley M Frame 2.0 SI Ballistic Z87 Apel Black Military Sunglasses,Pre-Owned,$58.00,"Sold  Oct 1, 2023Sold Item",16 bids,No,No
Oakley M Frame White Camo G30 Iridium Vented Hybrid Custom+Vault Case Golf NEW,New (Other),$460.00,"Sold  Oct 1, 2023Sold Item",,Yes,No
Oakley M Frame Black Sport Wrap Designer Sunglassses Polarized USA AS IS,Pre-Owned,$64.00,"Sold  Oct 1, 2023Sold Item",7 bids,No,No
Oakley M Frame 3.0 BONE Replacement Frame - New w/ USA Oakley Box,New (Other),$69.99,"Sold  Sep 23, 2023Sold Item",,Yes,No
VTG 1990s Oakley Mumbo Sunglasses M Frame Green/Brown Lens Very Minor Scratches,Pre-Owned,$199.00,"Sold  Oct 1, 2023Sold Item",,Yes,No
Oakley SI M Frame 2.0 Matte Black/Grey Sunglasses Z87 Plus Clear Lens,Pre-Owned,$89.99,"Sold  Sep 30, 2023Sold Item",,Yes,No
OAKLEY M FRAME LENS POSITIVE RED STRIKE IRIDIUM MINT W BOX 10/4/01 NOSE PC PRO,Pre-Owned,$279.99,"Sold  Sep 30, 2023Sold Item",,Yes,No
Galaxy Replacement Lens For Oakley Si Ballistic M Frame 2.0 VENTED Photochromic,New (Other),$11.99,"Sold  Sep 30, 2023Sold Item",,Yes,No
Oakley M frame Sunglasses with Nag,Pre-Owned,$145.00,"Sold  Sep 30, 2023Sold Item",,No,Yes
si ballistic m frame 2.0 strike Oakley Sunglasses,Brand New,$75.00,"Sold  Sep 30, 2023Sold Item",,Yes,No
Oakley M Frame Blue Iridium Sweep Lens - MINT,Pre-Owned,$99.99,"Sold  Sep 30, 2023Sold Item",,No,Yes
Oakley SI Ballistic M Frame Alpha Terrain Tan with Prizm Grey Lens - NEW,Brand New,$125.00,"Sold  Sep 30, 2023Sold Item",1 bid,No,No
Oakley M Frame Pro Metallic Emerald Green - Frame Only,Pre-Owned,$79.95,"Sold  Sep 30, 2023Sold Item",,Yes,No
Oakley SI Ballistic M Frame 2.0 Strike Safety Shooting Glasses Kit,Pre-Owned,$114.99,"Sold  Sep 30, 2023Sold Item",,Yes,No
Oakley SI Ballistic M Frame 2.0 Strike Array Frame Black Lense Clear Grey,Brand New,$80.00,"Sold  Sep 30, 2023Sold Item",4 bids,No,No
Men's Oakley M2 Frame Sunglasses,Pre-Owned,$34.00,"Sold  Sep 30, 2023Sold Item",6 bids,No,No
Oakley Minute Pearl Blue/Black Iridium Very Rare Made In USA,Pre-Owned,$110.00,"Sold  Sep 30, 2023Sold Item",,Yes,No
NEW OAKLEY M2 FRAME SUNGLASSES CARBON FIBER FRAME ICE IRIDIUM LENS RARE BLUE,Brand New,$149.99,"Sold  Sep 30, 2023Sold Item",,Yes,No
Oakley Standard Issue Ballistic M Frame 2.0 Men's Sunglasses - Black/Clear,Brand New,$68.00,"Sold  Sep 29, 2023Sold Item",1 bid,No,No
Brand New OAKLEY SI BALLISTIC M FRAMEÂ® ALPHA OPERATOR KIT/ Free Shipping,New (Other),$235.00,"Sold  Sep 28, 2023Sold Item",,No,Yes
Oakley M2 OO9343-09 Sunglasses - Polished Black Frame - Polarized Lens w/ Leash,Pre-Owned,$53.00,"Sold  Sep 29, 2023Sold Item",17 bids,No,No
Oakley SI Ballistic M Frame 2.0 Strike Array Frame Black Lense Clear Grey 11-138,Brand New,$89.00,"Sold  Sep 29, 2023Sold Item",,No,Yes
Oakley M Frame Pro Lance Armstrong FMJ 5.56/Flag Box Manual/Pamphlet AwEsOmE!!!,Pre-Owned,$249.00,"Sold  Sep 29, 2023Sold Item",,Yes,No
Oakley SI Ballistic M Frame 3.0 - Black w/ Grey & Clear Lenses (OO9146-03),Brand New,$129.99,"Sold  Sep 29, 2023Sold Item",,Yes,No
Galaxy Replacement Lens Oakley Si Ballistic M Frame 2.0 Z87 H.D Pink Color,New (Other),$7.55,"Sold  Sep 29, 2023Sold Item",,Yes,No
Oakley M Frame Red Gray Lens GUC,Pre-Owned,$100.00,"Sold  Sep 29, 2023Sold Item",,No,Yes
NEW* OAKLEY M2 Frame Black W Grey Lens Baseball Bike Tennis Sunglass 9343-01,Brand New,$89.88,"Sold  Sep 29, 2023Sold Item",,Yes,No
Oakley M2 Frame XL - Polished Black w/ Black Iridium Polarized Lens - New in Box,Brand New,$119.99,"Sold  Sep 29, 2023Sold Item",,Yes,No
Shop on eBay,Brand New,$20.00,,,Yes,No
Oakley 09-058 Pro M Frame Black Frame Black Iridium New Hybrid Lens Sunglasses,Pre-Owned,$200.59,"Sold  Sep 29, 2023Sold Item",,No,Yes
Oakley M Frame Jet Black Sunglasses - Gold Iridium Vented Sweep - VERY NICE,Pre-Owned,$119.99,"Sold  Sep 29, 2023Sold Item",,No,Yes
Oakley Sunglasses Frame:  M2 frame - Polished Navy,New (Other),$69.99,"Sold  Sep 28, 2023Sold Item",,Yes,No
Vintage Oakley M Frame Red Iridium Strike Box - BOX Only,Pre-Owned,$49.99,"Sold  Sep 28, 2023Sold Item",,No,Yes
"Oakley SI Ballistic M Frame 2.0 W/ Hard Shell Case, 3 Lenses Xtra Nose Piece.",Excellent Condition & Extras Included. See Description!,$69.99,"Sold  Sep 28, 2023Sold Item",2 bids,No,No
Oakley Mumbo M Frame Gen 1 Grey Heater lens - LENS ONLY - MINT,Pre-Owned,$179.99,"Sold  Sep 28, 2023Sold Item",,Yes,No
NEW OAKLEY OO9102 HOLBROOK M855 BLACK AUTHENTIC FRAMES SUNGLASSES W/ CASE 57-18,New (Other),$120.00,"Sold  Sep 28, 2023Sold Item",,Yes,No
Oakley M Frame Sunglasses Black Frames w/ HI Orange Iridium Hybrid Lens,Pre-Owned,$67.00,"Sold  Sep 28, 2023Sold Item",13 bids,No,No
Oakley M Frame Blue W/Black Iridium Lenses,Pre-Owned,$138.00,"Sold  Sep 28, 2023Sold Item",,Yes,No
oakley m frame sunglasses,Pre-Owned,$100.00,"Sold  Sep 28, 2023Sold Item",1 bid,No,No
Oakley M Frames FMJ Silver Orange/Fire Iridium Vented Strike Sunglasses RARE,Pre-Owned,$75.00,"Sold  Sep 28, 2023Sold Item",,Yes,No
Oakley M Frame Black,Pre-Owned,$55.99,"Sold  Sep 28, 2023Sold Item",,Yes,No
OAKLEY PRO M FRAME KIT NEW IN BOX NOSE PIECE W 2 EAR SOCKS BLACK,Brand New,$14.50,"Sold  Sep 28, 2023Sold Item",5 bids,No,No
Oakley M2 Frame XL Sunglasses OO9343-05 Polished White Black Polarized Lens,Pre-Owned,$55.98,"Sold  Sep 28, 2023Sold Item",,No,Yes
"OAKLEY M-Frame Sunglasses W/Amber Colored Lenses, Made in USA, Excellent",Pre-Owned,$94.00,"Sold  Sep 28, 2023Sold Item",,No,Yes
Oakley M Frame Sunglass Lenses Only. Comes In A Case. Z87+S Great Condition ðŸ˜Ž,Pre-Owned,$39.99,"Sold  Sep 28, 2023Sold Item",,Yes,No
Oakley M Frame CRYSTAL BLUE/GRAY Lens Mumbo Gen 2 RARE HammerFang Stems,Pre-Owned,$189.99,"Sold  Sep 28, 2023Sold Item",,Yes,No
Oakley M Frame Sunglasses Made In USA Some Wear,Pre-Owned,$64.99,"Sold  Sep 28, 2023Sold Item",,Yes,No
OAKLEY SI M FRAME2.0 Z87 Ballistic Shooting Glasses,Pre-Owned,$46.00,"Sold  Sep 28, 2023Sold Item",15 bids,No,No
Oakley M2 Frame XL Sunglasses 2015 Oo9343-08 Polished Black Prizm Road,Brand New,$109.00,"Sold  Sep 28, 2023Sold Item",,Yes,No
SUNGLASSES OAKLEY SI BALLISTIC M FRAME 3.0 (009146-3332) MATTE BLACK/ PRIZM GREY,Brand New,$160.00,"Sold  Sep 28, 2023Sold Item",,Yes,No
Oakley M2 Frame XL Prizm Sapphire Sport Men's Sunglasses OO9343 934321 45,Brand New,$106.69,"Sold  Sep 20, 2023Sold Item",,Yes,No
Oakley M Frame (New Gen) Crystal Black - BROW ONLY - MINT,Pre-Owned,$29.99,"Sold  Sep 28, 2023Sold Item",,Yes,No
"Oakley M Frame Mumbo ""The Bridge"" Shadow Camo Prizm Ruby/Jade Heater - NEW",Brand New,$449.99,"Sold  Sep 27, 2023Sold Item",,No,Yes
Oakley SI Ballistic M Frame Alpha  Terrain Tan. Grey Lens Model  009296,Brand New,$150.00,"Sold  Sep 27, 2023Sold Item",,Yes,No
oakley si m frame Kit Ballistic Lightly Used,Pre-Owned,$81.00,"Sold  Sep 27, 2023Sold Item",7 bids,No,No
Oakley Safety Glasses Frame W/Case **NO LENS** Z87 SI M Frame 2.0 Black Shooting,Pre-Owned,$21.84,"Sold  Sep 27, 2023Sold Item",,No,Yes
Oakley Sunglasses - 0OO9213 - Industrial M Frame 2.0 w/Grey,Brand New,$89.99,"Sold  Sep 27, 2023Sold Item",,No,Yes
Oakley SI Ballistic M Frame 2.0 (OO9213) - FRAME ONLY (No Lenses) BNIB Authentic,Brand New,$53.29,"Sold  Sep 27, 2023Sold Item",,Yes,No
Oakley M2 Frame Polished Black Sunglasses W/ Polarized Black Lens,Pre-Owned,$75.00,"Sold  Sep 27, 2023Sold Item",,Yes,No
OAKLEY SUNGLASSES M FRAME GEN - 2 SWEEP  RUBY LENS CUSTOM SPLATTER VINTAGE,Pre-Owned,$37.00,"Sold  Sep 27, 2023Sold Item",2 bids,No,No
OAKLEY SUNGLASSES M FRAME GEN - 2 STRIKE RUBY LENS CUSTOM SPLATTER VINTAGE,Pre-Owned,$52.00,"Sold  Sep 27, 2023Sold Item",4 bids,No,No
Oakley Sunglasses NEW M FRAME BASEBALL HEATER  pink/purple custom splatter!,Pre-Owned,$125.00,"Sold  Sep 27, 2023Sold Item",1 bid,No,No
Vintage Oakley Black M Frame Sunglasses w/Original Oakley Black Lens,Pre-Owned,$74.99,"Sold  Sep 27, 2023Sold Item",,Yes,No
Oakley M Frame *good condition* Red and White with Grey Lens *Rare Find*ðŸ•¶ï¸,Pre-Owned,$150.00,"Sold  Sep 26, 2023Sold Item",4 bids,No,No
Oakley Polished Black M2 Frame,Pre-Owned,$45.50,"Sold  Sep 26, 2023Sold Item",,Yes,No
"Oakley M Frame Sunglasses With Case, Interchangeable Lenses and Nose Peices!",Pre-Owned,$200.00,"Sold  Sep 26, 2023Sold Item",,Yes,No
Oakley Metal Vault Case - NEAR MINT,Pre-Owned,$99.99,"Sold  Sep 26, 2023Sold Item",,Yes,No
Nose Pads+Earsocks Rubber Kits 4 Oakley M Frame Strike/Heater/Sweep/Hybrid White,New (Other),$9.88,"Sold  Sep 26, 2023Sold Item",,Yes,No
Oakley M Frame Gen 2 Carbon Fiber Sunglasses USA Black Iridium Sweep W/ Hardcase,Pre-Owned,$150.00,"Sold  Sep 26, 2023Sold Item",,Yes,No
Vintage Oakley M Frame sunglasses With Spare Lens,Pre-Owned,$51.00,"Sold  Sep 26, 2023Sold Item",17 bids,No,No
Oakley Matte Black M2 Frame Black Iridium Sunglasses 09343-1945,Pre-Owned,$79.99,"Sold  Sep 26, 2023Sold Item",,No,Yes
Oakley Sunglasses Frame:  M2 frame - Carbon Fiber,New (Other),$74.99,"Sold  Sep 26, 2023Sold Item",,Yes,No
Oakley Vintage authentic M Frame Sunglasses With 3 new Lenses,Pre-Owned,$349.99,"Sold  Sep 26, 2023Sold Item",,Yes,No
Oakley Men's Sunglasses M FRAME SUNGLASSES BLACK ON BLACK,Pre-Owned,$56.00,"Sold  Sep 25, 2023Sold Item",2 bids,No,No
Oakley M-Frame Green Sunglasses,Pre-Owned,$66.00,"Sold  Sep 25, 2023Sold Item",22 bids,No,No
Oakley M Frame Matte Black Frame w/ Chrome Oakley Icons - Used / Read,Pre-Owned,$75.00,"Sold  Sep 25, 2023Sold Item",,Yes,No
Oakley M Frame Gen 2 ? Black Frame Z87 + S 121407 Changeable Lens With Case Read,Pre-Owned,$140.00,"Sold  Sep 25, 2023Sold Item",,No,Yes
Oakley SI Ballistic M Frame 3.0 Safety Shooting Glasses Kit (Used ONCE!),Pre-Owned,$75.00,"Sold  Sep 25, 2023Sold Item",,Yes,No
Oakley Ballistic M-Frame 3.0 Glasses Black Frame TR45 Prizm Lenses OO9146-20 NEW,Brand New,$127.99,"Sold  Sep 20, 2023Sold Item",,Yes,No
Oakley SI Ballistic M Frame 2.0 (OO9213) - FRAME ONLY (No Lenses) BNIB Authentic,Brand New,$53.29,"Sold  Sep 24, 2023Sold Item",,Yes,No
Oakley M-Frame Sunglasses ( Read Description ),Pre-Owned,$58.00,"Sold  Sep 24, 2023Sold Item",26 bids,No,No
AUTHENTIC OAKLEY M-FRAME BLACK EAR SOCKS TEMPLE TIPS & NOSE PAD KIT NEW! 06-596,Brand New,$18.99,"Sold  Sep 24, 2023Sold Item",,Yes,No
NEW OAKLEY SI Ballistic Sun Glasses M Frame 2.0 Array Strike Clear & Gray APEL,New (Other),$64.95,"Sold  Sep 24, 2023Sold Item",,Yes,No
Lance Armstrong Signature M Frame Oakley Sunglasses Hybrid S 5.56 Ice Lens,Brand New,$192.52,"Sold  Sep 24, 2023Sold Item",13 bids,No,No
Oakley M2 Frame Sunglasses OO9254-02 Polished Black/G30 Iridium Asian,Brand New,$109.99,"Sold  Sep 24, 2023Sold Item",,Yes,No
Oakley 11-138 SI Ballistic Military M Frame 2.0 Black Frame 2x Lens Sunglasses,Pre-Owned,$75.99,"Sold  Sep 24, 2023Sold Item",,Yes,No
Oakley White Sweep M Frame Jade Iridium  09-193 Wrap Sunglasses,Pre-Owned,$102.50,"Sold  Sep 24, 2023Sold Item",28 bids,No,No
"Oakley M frame sunglasses, Clear And Tinted Lenses, Case And Carrying Case!ðŸ”¥",Pre-Owned,$49.99,"Sold  Sep 23, 2023Sold Item",,Yes,No
OAKLEY M FRAME BLUE W ELECTRIC BLUE HOUSE HINGE SUNGLASSES VINTAGE PRO FRAMES,Pre-Owned,$100.00,"Sold  Sep 23, 2023Sold Item",,Yes,No
Shop on eBay,Brand New,$20.00,,,Yes,No
Oakley Matte Black SI M Frame 2.0 Fire Red  Sunglasses,Pre-Owned,$55.00,"Sold  Sep 23, 2023Sold Item",,No,Yes
Oakley M Frame Yellow Sweep Lens Lenses LOT - NICE 3 Replacement Polarized Black,Pre-Owned,$69.99,"Sold  Sep 23, 2023Sold Item",,Yes,No
Galaxy Nose Pads Rubber Kits For Oakley Si Ballistic M Frame 3.0 Z87 Black,New (Other),$5.95,"Sold  Sep 23, 2023Sold Item",,Yes,No
Oakley M Frame Black,Pre-Owned,$62.99,"Sold  Sep 22, 2023Sold Item",,Yes,No
Oakley M Frame Burnt Orange!! Rare!! Gold Oâ€™s!! VGC!!,Pre-Owned,$139.00,"Sold  Sep 22, 2023Sold Item",,Yes,No
"Vintage OAKLEY Oakley Sunglasses Black 12-932 EYEPATCH, Sideways, 2 M Frames",Pre-Owned,$199.95,"Sold  Sep 22, 2023Sold Item",,No,Yes
Oakley M Frame Polished Black Clear Strike Silver Icons RARE,Pre-Owned,$59.99,"Sold  Sep 22, 2023Sold Item",,Yes,No
Oakley Polished M frame W/ Grey Hybrid lenses,New (Other),$450.00,"Sold  Sep 22, 2023Sold Item",,Yes,No
Oakley Vintage M Frame Pro Matte Black W/ Gray Iridium & G30 Lenses +Hard Case,Pre-Owned,$235.00,"Sold  Sep 22, 2023Sold Item",,Yes,No
Oakley SI Ballistic M Frame Alpha Model  009296,Brand New,$90.00,"Sold  Sep 22, 2023Sold Item",,Yes,No
Oakley Gauge 8 M 004124 Sunglasses Lead Gunmetal Frame Sapphire Prizm Lens $240,Brand New,$89.98,"Sold  Sep 22, 2023Sold Item",,Yes,No
Oakley SI Ballistic M Frame 3.0 Black Wrap Glasses Kit Hardcover Case - USA Used,Pre-Owned,$40.00,"Sold  Sep 22, 2023Sold Item",13 bids,No,No
Oakley M Frame Clear Heater Replacement Lens 06-703 NEW RARE,Brand New,$99.99,"Sold  Sep 22, 2023Sold Item",,Yes,No
Oakley M2 XL Polished Black Frame only,Pre-Owned,$65.00,"Sold  Sep 22, 2023Sold Item",,Yes,No
OAKLEY M2 FRAME XL Black PRIZM SAPPHIRE,Pre-Owned,$85.00,"Sold  Sep 22, 2023Sold Item",,Yes,No
Oakley SI Ballistic M Frame 2.0 Strike Array Frame Black Lense Clear Grey 11-138,Brand New,$89.00,"Sold  Sep 22, 2023Sold Item",,Yes,No
NEW OAKLEY SI Ballistic Sun Glasses M Frame 2.0 Array Strike Clear & Gray APEL,New (Other),$88.00,"Sold  Sep 22, 2023Sold Item",,No,Yes
Oakley M-Frame Sunglasses,Pre-Owned,$48.00,"Sold  Sep 22, 2023Sold Item",,Yes,No
Oakley SI Ballistic M Frame 2.0 APEL Black Sunglasses,Pre-Owned,$45.00,"Sold  Sep 22, 2023Sold Item",,No,Yes
Oakley M2 Frame XL OO9343 Matte Black with Prizm Black Polarized Lens Wrap Men's,Brand New,$100.00,"Sold  Sep 21, 2023Sold Item",1 bid,No,No
Oakley Men's Black M2 Frame Polarized Glasses,Pre-Owned,$49.99,"Sold  Sep 21, 2023Sold Item",,Yes,No
Oakley Gauge 8 M 004124 Sunglasses Matte Black Frame Prizm Polarized Lens $240,Brand New,$119.00,"Sold  Sep 21, 2023Sold Item",,Yes,No
Oakley M2 OO9343-09 Sunglasses - Polished Black Frame - Polarized Lens w/ Leash,Pre-Owned,$45.00,"Sold  Sep 21, 2023Sold Item",14 bids,No,No
oakley m frame sunglasses,Pre-Owned,$50.00,"Sold  Sep 21, 2023Sold Item",1 bid,No,No
Oakley APEL SI M Frame 2.0 Matte Black Dark Gray Wrap Lens Sunglasses,Pre-Owned,$59.95,"Sold  Sep 21, 2023Sold Item",,No,Yes
Oakley SI M Frame 2.0 Men's Matte  Wrap Lens Sunglasses Scratched,Pre-Owned,$29.99,"Sold  Sep 21, 2023Sold Item",,No,Yes
Oakley M Frame Carbon Fiber Black Iridium Sweep Box Only 09-126,Pre-Owned,$29.99,"Sold  Sep 21, 2023Sold Item",,Yes,No
Oakley Brown M Frame Prescription Sunglasses / Frames Made In USA CE,Pre-Owned,$55.00,"Sold  Sep 21, 2023Sold Item",,Yes,No
Oakley New M frame Joker w/ Persimmon Heater Lenses new,New (Other),$350.00,"Sold  Sep 21, 2023Sold Item",,Yes,No
Oakley SI Ballistic M2 Frame Replacement Lens,Brand New,$35.00,"Sold  Sep 21, 2023Sold Item",,Yes,No
Wholesale POLARIZED Replacement Lens for-Oakley M Frame Sweep Vented Sunglasses,Brand New,$6.95,"Sold  Sep 21, 2023Sold Item",,Yes,No
Oakley M Frame Crystal Clear Gold Iridium Sweep Gen 1 Mumbo Blue Ear Socks,Pre-Owned,$349.99,"Sold  Sep 20, 2023Sold Item",,Yes,No
RARE COLOR! Oakley M Frames Pro Yellow/Black Iridium Sunglasses,Pre-Owned,$179.99,"Sold  Sep 20, 2023Sold Item",,Yes,No
oakley sunglasses M Frame Black And Grey Lot Of 2,Pre-Owned,$35.00,"Sold  Sep 20, 2023Sold Item",1 bid,No,No
OAKLEY M-FRAME Sunglasses Black Frame Authentic,Pre-Owned,$47.00,"Sold  Sep 20, 2023Sold Item",2 bids,No,No
New Walleva Gray Earsocks + Gray Nosepads For Oakley M Frame Sunglasses,Brand New,$10.98,"Sold  Sep 20, 2023Sold Item",,Yes,No
OAKLEY M2 FRAME XL CUSTOM MATTE BLACK ORANGE FIRE IRIDIUM SUNGLASSES OO9343 NEW,New (Other),$160.00,"Sold  Sep 20, 2023Sold Item",,Yes,No
Oakley SI Ballistic M Frame 3.0 Matte Black Z87 Clear & Gray Lenses 0OO9146 NIB,New (Other),$62.00,"Sold  Sep 20, 2023Sold Item",10 bids,No,No
Oakley SI Ballistic M Frame 2.0 w/ VR28 Hybrid Lenses,Pre-Owned,$120.00,"Sold  Sep 20, 2023Sold Item",,Yes,No
Oakley Ballistic M-Frame 3.0 Glasses Black Frame TR45 Prizm Lenses OO9146-20 NEW,Brand New,$127.99,"Sold  Sep 20, 2023Sold Item",,Yes,No
OAKLEY M frame 2.0 Ballistic Black POLARIZED Galaxy Chrome mirror Sunglass 9046,Brand New,$128.87,"Sold  Sep 19, 2023Sold Item",,Yes,No
Oakley M Frame Lens Yellow Heater!! Rare!! VGC!!!,Pre-Owned,$49.00,"Sold  Sep 19, 2023Sold Item",,Yes,No
"2 Pairs of Menâ€™s Oakleyâ€™s, M Frame And FLAK 2.0 XL",Pre-Owned,$107.50,"Sold  Sep 19, 2023Sold Item",3 bids,No,No
NEW OAKLEY M2 FRAME XL : POLISHED BLACK / GREY LENS OO9343-01,Brand New,$80.00,"Sold  Sep 17, 2023Sold Item",,Yes,No
Oakley M Frame Matte Black - Black Iridium Heater - NEAR MINT,Pre-Owned,$149.99,"Sold  Sep 19, 2023Sold Item",,Yes,No
New Walleva Black Replacement Lenses For Oakley M Frame Strike,Brand New,$16.99,"Sold  Sep 19, 2023Sold Item",,Yes,No
Oakley Standard Issue Ballistic M Frame 2.0 Men's Sunglasses - Black/Clear,Brand New,$69.00,"Sold  Sep 19, 2023Sold Item",2 bids,No,No
2 RARE ORIGINAL OAKLEY M FRAME or M2 or SI BALLISTIC 3.0 LENSES,New (Other),$64.88,"Sold  Sep 18, 2023Sold Item",,Yes,No
Oakley M Frame Orange Replacement Lens W Case,New (Other),$29.99,"Sold  Sep 18, 2023Sold Item",,Yes,No
Oakley Pro M Frame Red Sunglasses Used,Pre-Owned,$318.99,"Sold  Sep 18, 2023Sold Item",,Yes,No
Oakley M Frame Pro FMJ,Pre-Owned,$250.00,"Sold  Sep 18, 2023Sold Item",1 bid,No,No
Vintage Oakley M Frame sunglasses With Spare Lens,Pre-Owned,$92.00,"Sold  Sep 18, 2023Sold Item",19 bids,No,No
OAKLEY M FRAME 1.0 STRIKE MATTE BLACK GREY INDUSTRIAL SUNGLASSES 11-162 Z87.1,Brand New,$145.00,"Sold  Sep 18, 2023Sold Item",,Yes,No
